Licence Art Libre 1.3,LAL-1.3,http://artlibre.org/,"French is the canonical language for this license. Translations are available in:English:  http://artlibre.org/licence/lal/en/Portuguese: http://artlibre.org/licence/lal/pt/Polish: http://artlibre.org/licence/lal/pl/",,,LAL-1.3.txt,,,,,,,,,,NEW-Fedora,,,,,,,,,,,,,,,,,,,,,,,,,,,,,,,,,,,,,,,,,,,,,,,,,,,,,,,,,,,,,,,,,,,,,,,,,,,,,,,,,,,,,,,,,,,,,,,,,,,,,,,,,,,,,,,,,,,,,,,,,,,,,,,,,,,,,,,,,,,,,,,,,,,,,,,,,,,,,,,,,,,,,,,,,,,,,,,,,,,,,,,,,,,,,,,,,,,,,,,,,,,,,,,,,,,,,,,,,,,,,,,,,,,,,,,,,,,,,,,Licence Libre du Québec – Permissive version 1.1,LiLiQ-P-1.1,"http://opensource.org/licenses/LiLiQ-P-1.1https://www.forge.gouv.qc.ca/participez/licence-logicielle/licence-libre-du-quebec-liliq-en-francais/licence-libre-du-quebec-liliq-en-francais-v1-0/licence-libre-du-quebec-reciprocite-liliq-r-v1-0/",French is the canonical language for this license. An English translation is provided here: https://www.forge.gouv.qc.ca/participez/licence-logicielle/licence-libre-du-quebec-liliq-in-english/quebec-free-and-open-source-licence-%C2%96-permissive-liliq-p-v1-1/,YES,,LiLiQ-P-1.1.txt,,,,,,,,,,NEW-Fedora,,,,,,,,,,,,,,,,,,,,,,,,,,,,,,,,,,,,,,,,,,,,,,,,,,,,,,,,,,,,,,,,,,,,,,,,,,,,,,,,,,,,,,,,,,,,,,,,,,,,,,,,,,,,,,,,,,,,,,,,,,,,,,,,,,,,,,,,,,,,,,,,,,,,,,,,,,,,,,,,,,,,,,,,,,,,,,,,,,,,,,,,,,,,,,,,,,,,,,,,,,,,,,,,,,,,,,,,,,,,,,,,,,,,,,,,,,,,,,,Licence Libre du Québec – Réciprocité forte version 1.1,LiLiQ-Rplus-1.1,"http://opensource.org/licenses/LiLiQ-Rplus-1.1https://www.forge.gouv.qc.ca/participez/licence-logicielle/licence-libre-du-quebec-liliq-en-francais/licence-libre-du-quebec-reciprocite-forte-liliq-r-v1-1/",French is the canonical language for this license. An English translation is provided here: https://www.forge.gouv.qc.ca/participez/licence-logicielle/licence-libre-du-quebec-liliq-in-english/quebec-free-and-open-source-licence-strong-reciprocity-liliq-r-v1-1/,YES,,LiLiQ-Rplus-1.1.txt,,,,,,,,,,,,,,,,,,,,,,,,,,,,,,,,,,,,,,,,,,,,,,,,,,,,,,,,,,,,,,,,,,,,,,,,,,,,,,,,,,,,,,,,,,,,,,,,,,,,,,,,,,,,,,,,,,,,,,,,,,,,,,,,,,,,,,,,,,,,,,,,,,,,,,,,,,,,,,,,,,,,,,,,,,,,,,,,,,,,,,,,,,,,,,,,,,,,,,,,,,,,,,,,,,,,,,,,,,,,,,,,,,,,,,,,,,,,,,,,,,,,,,,,,Licence Libre du Québec – Réciprocité version 1.1,LiLiQ-R-1.1,"http://opensource.org/licenses/LiLiQ-R-1.1https://www.forge.gouv.qc.ca/participez/licence-logicielle/licence-libre-du-quebec-liliq-en-francais/licence-libre-du-quebec-reciprocite-liliq-r-v1-1/",French is the canonical language for this license. An English translation is provided here: https://www.forge.gouv.qc.ca/participez/licence-logicielle/licence-libre-du-quebec-liliq-in-english/quebec-free-and-open-source-licence-reciprocity-liliq-r-v1-1/,YES,,LiLiQ-R-1.1.txt,,,,,,,,,,,,,,,,,,,,,,,,,,,,,,,,,,,,,,,,,,,,,,,,,,,,,,,,,,,,,,,,,,,,,,,,,,,,,,,,,,,,,,,,,,,,,,,,,,,,,,,,,,,,,,,,,,,,,,,,,,,,,,,,,,,,,,,,,,,,,,,,,,,,,,,,,,,,,,,,,,,,,,,,,,,,,,,,,,,,,,,,,,,,,,,,,,,,,,,,,,,,,,,,,,,,,,,,,,,,,,,,,,,,,,,,,,,,,,,,,,,,,,,,,Lucent Public License v1.02,LPL-1.02,"http://plan9.bell-labs.com/plan9/license.htmlhttp://www.opensource.org/licenses/LPL-1.02",,YES,,LPL-1.02.txt,,,,,,OSI issue resolved (OSI website),,,,,,,,,,,,,,,,,,,,,,,,,,,,,,,,,,,,,,,,,,,,,,,,,,,,,,,,,,,,,,,,,,,,,,,,,,,,,,,,,,,,,,,,,,,,,,,,,,,,,,,,,,,,,,,,,,,,,,,,,,,,,,,,,,,,,,,,,,,,,,,,,,,,,,,,,,,,,,,,,,,,,,,,,,,,,,,,,,,,,,,,,,,,,,,,,,,,,,,,,,,,,,,,,,,,,,,,,,,,,,,,,,,,,,,,,,,,,,,,,,,Lucent Public License Version 1.0,LPL-1.0,http://opensource.org/licenses/LPL-1.0,,YES,,LPL-1.0.txt,,,,,,,,,,NEW-Fedora,,,,,,,,,,,,,,,,,,,,,,,,,,,,,,,,,,,,,,,,,,,,,,,,,,,,,,,,,,,,,,,,,,,,,,,,,,,,,,,,,,,,,,,,,,,,,,,,,,,,,,,,,,,,,,,,,,,,,,,,,,,,,,,,,,,,,,,,,,,,,,,,,,,,,,,,,,,,,,,,,,,,,,,,,,,,,,,,,,,,,,,,,,,,,,,,,,,,,,,,,,,,,,,,,,,,,,,,,,,,,,,,,,,,,,,,,,,,,,,MakeIndex License,MakeIndex,https://fedoraproject.org/wiki/Licensing/MakeIndex,,,,MakeIndex.txt,,,,,,,,,,,,,,,,,,,,,,,,,,,,,,,,,,,,,,,,,,,,,,,,,,,,,,,,,,,,,,,,,,,,,,,,,,,,,,,,,,,,,,,,,,,,,,,,,,,,,,,,,,,,,,,,,,,,,,,,,,,,,,,,,,,,,,,,,,,,,,,,,,,,,,,,,,,,,,,,,,,,,,,,,,,,,,,,,,,,,,,,,,,,,,,,,,,,,,,,,,,,,,,,,,,,,,,,,,,,,,,,,,,,,,,,,,,,,,,,,,,,,,,,,Matrix Template Library License,MTLL,https://fedoraproject.org/wiki/Licensing/Matrix_Template_Library_License,,,,MTLL.txt,,,,,,,,,,,,,,,,,,,,,,,,,,,,,,,,,,,,,,,,,,,,,,,,,,,,,,,,,,,,,,,,,,,,,,,,,,,,,,,,,,,,,,,,,,,,,,,,,,,,,,,,,,,,,,,,,,,,,,,,,,,,,,,,,,,,,,,,,,,,,,,,,,,,,,,,,,,,,,,,,,,,,,,,,,,,,,,,,,,,,,,,,,,,,,,,,,,,,,,,,,,,,,,,,,,,,,,,,,,,,,,,,,,,,,,,,,,,,,,,,,,,,,,,,Microsoft Public License,MS-PL,"http://www.microsoft.com/opensource/licenses.mspxhttp://www.opensource.org/licenses/MS-PL",,YES,,MS-PL.txt,,,,H-YES,may need to update OSI link later,,,OSI url updated,,,,,,,added markup to standard header,,,,,,,,,,,,,,,,,,,,,,,,,,,,,,,,,,,,,,,,,,,,,,,,,,,,,,,,,,,,,,,,,,,,,,,,,,,,,,,,,,,,,,,,,,,,,,,,,,,,,,,,,,,,,,,,,,,,,,,,,,,,,,,,,,,,,,,,,,,,,,,,,,,,,,,,,,,,,,,,,,,,,,,,,,,,,,,,,,,,,,,,,,,,,,,,,,,,,,,,,,,,,,,,,,,,,,,,,,,,,,,,,,,,,,,,,,Microsoft Reciprocal License,MS-RL,"http://www.microsoft.com/opensource/licenses.mspxhttp://www.opensource.org/licenses/MS-RL",,YES,,MS-RL.txt,,,,H-YES,,,,,,,,,,,added markup to standard header,,,,,,,,,,,,,,,,,,,,,,,,,,,,,,,,,,,,,,,,,,,,,,,,,,,,,,,,,,,,,,,,,,,,,,,,,,,,,,,,,,,,,,,,,,,,,,,,,,,,,,,,,,,,,,,,,,,,,,,,,,,,,,,,,,,,,,,,,,,,,,,,,,,,,,,,,,,,,,,,,,,,,,,,,,,,,,,,,,,,,,,,,,,,,,,,,,,,,,,,,,,,,,,,,,,,,,,,,,,,,,,,,,,,,,,,,,MirOS Licence,MirOS,http://www.opensource.org/licenses/MirOS,,YES,,MirOS.txt,,,,,,notes updated,,,,,,,,,,,,,,,,,,,,,,,,,,,,,,,,,,,,,,,,,,,,,,,,,,,,,,,,,,,,,,,,,,,,,,,,,,,,,,,,,,,,,,,,,,,,,,,,,,,,,,,,,,,,,,,,,,,,,,,,,,,,,,,,,,,,,,,,,,,,,,,,,,,,,,,,,,,,,,,,,,,,,,,,,,,,,,,,,,,,,,,,,,,,,,,,,,,,,,,,,,,,,,,,,,,,,,,,,,,,,,,,,,,,,,,,,,,,,,,,,,,MIT +no-false-attribs license,MITNFA,https://fedoraproject.org/wiki/Licensing/MITNFA,,,,MITNFA.txt,,,,,,NEW,full name of license updated,,,,,,,,,,,,,,,,,,,,,,,,,,,,,,,,,,,,,,,,,,,,,,,,,,,,,,,,,,,,,,,,,,,,,,,,,,,,,,,,,,,,,,,,,,,,,,,,,,,,,,,,,,,,,,,,,,,,,,,,,,,,,,,,,,,,,,,,,,,,,,,,,,,,,,,,,,,,,,,,,,,,,,,,,,,,,,,,,,,,,,,,,,,,,,,,,,,,,,,,,,,,,,,,,,,,,,,,,,,,,,,,,,,,,,,,,,,,,,,,,,MIT License,MIT,http://www.opensource.org/licenses/MIT,,YES,,MIT.txt,,,,,,,,,,NEW-Fedora,,,,,,,,,,,,,,,,,,,,,,,,,,,,,,,,,,,,,,,,,,,,,,,,,,,,,,,,,,,,,,,,,,,,,,,,,,,,,,,,,,,,,,,,,,,,,,,,,,,,,,,,,,,,,,,,,,,,,,,,,,,,,,,,,,,,,,,,,,,,,,,,,,,,,,,,,,,,,,,,,,,,,,,,,,,,,,,,,,,,,,,,,,,,,,,,,,,,,,,,,,,,,,,,,,,,,,,,,,,,,,,,,,,,,,,,,,,,,,,Motosoto License,Motosoto,http://www.opensource.org/licenses/Motosoto,,YES,"license mentions the inclusion of a notice in Exhibit A, but no example text identified as Exhibit A in the license.",Motosoto.txt,,,,,,OSI issue resolved (OSI website),,,,,,,,,,,,,,,,,,,,,,,,,,,,,,,,,,,,,,,,,,,,,,,,,,,,,,,,,,,,,,,,,,,,,,,,,,,,,,,,,,,,,,,,,,,,,,,,,,,,,,,,,,,,,,,,,,,,,,,,,,,,,,,,,,,,,,,,,,,,,,,,,,,,,,,,,,,,,,,,,,,,,,,,,,,,,,,,,,,,,,,,,,,,,,,,,,,,,,,,,,,,,,,,,,,,,,,,,,,,,,,,,,,,,,,,,,,,,,,,,,,Mozilla Public License 1.0,MPL-1.0,"http://www.mozilla.org/MPL/MPL-1.0.htmlhttp://opensource.org/licenses/MPL-1.0",This license has been superseded by v1.1,YES,"The contents of this file are subject to the Mozilla Public License Version 1.0 (the ""License""); you may not use this file except in compliance with the License. You may obtain a copy of the License at http://www.mozilla.org/MPL/Software distributed under the License is distributed on an ""AS IS"" basis, WITHOUT WARRANTY OF ANY KIND, either express or implied. See the License for the specific language governing rights and limitations under the License.The Original Code is <<var;name=code;original=_____;match=.+>>.The Initial Developer of the Original Code is <<var;name=InitialDeveloper;original=_____;match=.+>>. Portions created by <<var;name=createdby;original=_____;match=.+>> are Copyright (C) <<var;name=copyright;original=_____;match=.+>>. All Rights Reserved.Contributor(s): <<var;name=contributor;original=_____;match=.+>>.",MPL-1.0.txt,,,,,,,,,,NEW-Fedora,,,,,,,,,,,,,,,,,,,,,,,,,,,,,,,,,,,,,,,,,,,,,,,,,,,,,,,,,,,,,,,,,,,,,,,,,,,,,,,,,,,,,,,,,,,,,,,,,,,,,,,,,,,,,,,,,,,,,,,,,,,,,,,,,,,,,,,,,,,,,,,,,,,,,,,,,,,,,,,,,,,,,,,,,,,,,,,,,,,,,,,,,,,,,,,,,,,,,,,,,,,,,,,,,,,,,,,,,,,,,,,,,,,,,,,,,,,,,,,Mozilla Public License 1.1,MPL-1.1,"http://www.mozilla.org/MPL/MPL-1.1.htmlhttp://www.opensource.org/licenses/MPL-1.1",This license has been superseded by v2.0,YES,"The contents of this file are subject to the Mozilla Public License Version 1.1 (the ""License""); you may not use this file except in compliance with the License. You may obtain a copy of the License at http://www.mozilla.org/MPL/Software distributed under the License is distributed on an ""AS IS"" basis, WITHOUT WARRANTY OF ANY KIND, either express or implied. See the License for the specific language governing rights and limitations under the License.The Original Code is <<var;name=code;original=_____;match=.+>>.The Initial Developer of the Original Code is <<var;name=InitialDeveloper;original=_____;match=.+>>. Portions created by <<var;name=createdby;original=_____;match=.+>> are Copyright (C) <<var;name=copyright;original=_____;match=.+>>. All Rights Reserved.Contributor(s): <<var;name=contributor;original=_____;match=.+>>.Alternatively, the contents of this file may be used under the terms of the <<var;name=AltLicense;original=_____;match=.+>> license (the  ""<<var;name=licenseName;original=[____];match=.+>> License""), in which case the provisions of <<var;name=licenseName;original=[____];match=.+>> License are applicable instead of those above. If you wish to allow use of your version of this file only under the terms of the <<var;name=licenseName;original=[____];match=.+>> License and not to allow others to use your version of this file under the MPL, indicate your decision by deleting the provisions above and replace them with the notice and other provisions required by the <<var;name=licenseName;original=[____];match=.+>> License. If you do not delete the provisions above, a recipient may use your version of this file under either the MPL or the<<var;name=licenseName;original=[____];match=.+>>] License.""",MPL-1.1.txt,,,,,,,,,,,,,,,,,,,,,,,,,,,,,,,,,,,,,,,,,,,,,,,,,,,,,,,,,,,,,,,,,,,,,,,,,,,,,,,,,,,,,,,,,,,,,,,,,,,,,,,,,,,,,,,,,,,,,,,,,,,,,,,,,,,,,,,,,,,,,,,,,,,,,,,,,,,,,,,,,,,,,,,,,,,,,,,,,,,,,,,,,,,,,,,,,,,,,,,,,,,,,,,,,,,,,,,,,,,,,,,,,,,,,,,,,,,,,,,,,,,,,,,,,Mozilla Public License 2.0,MPL-2.0,"http://www.mozilla.org/MPL/2.0/http://opensource.org/licenses/MPL-2.0","This license was released in January 2012.This license list entry is for use when the standard MPL 2.0 is used, as indicated by the standard header (Exhibit A but no Exhibit B).",YES,"This Source Code Form is subject to the terms of the Mozilla Public License, v. 2.0. If a copy of the MPL was not distributed with this file, You can obtain one at http://mozilla.org/MPL/2.0/.",MPL-2.0.txt,,,,,,,,,,,,,,,,,,,,,,,,,,,,,,,,,,,,,,,,,,,,,,,,,,,,,,,,,,,,,,,,,,,,,,,,,,,,,,,,,,,,,,,,,,,,,,,,,,,,,,,,,,,,,,,,,,,,,,,,,,,,,,,,,,,,,,,,,,,,,,,,,,,,,,,,,,,,,,,,,,,,,,,,,,,,,,,,,,,,,,,,,,,,,,,,,,,,,,,,,,,,,,,,,,,,,,,,,,,,,,,,,,,,,,,,,,,,,,,,,,,,,,,,,Mozilla Public License 2.0 (no copyleft exception),MPL-2.0-no-copyleft-exception,"http://www.mozilla.org/MPL/2.0/http://opensource.org/licenses/MPL-2.0","This license was released in January 2012.This license list entry is for use when the MPL's Exhibit B, which removes the Sec 3.3 copyleft exception.",YES,"This Source Code Form is subject to the terms of the Mozilla Public License, v. 2.0. If a copy of the MPL was not distributed with this file, You can obtain one at http://mozilla.org/MPL/2.0/.This Source Code Form is “Incompatible With Secondary Licenses”, as defined by the Mozilla Public License, v. 2.0.",MPL-2.0-no-copyleft-exception.txt,,,,,,,NEW,,,,,,,,,,,,,,,,,,,,,,,,,,,,,,,,,,,,,,,,,,,,,,,,,,,,,,,,,,,,,,,,,,,,,,,,,,,,,,,,,,,,,,,,,,,,,,,,,,,,,,,,,,,,,,,,,,,,,,,,,,,,,,,,,,,,,,,,,,,,,,,,,,,,,,,,,,,,,,,,,,,,,,,,,,,,,,,,,,,,,,,,,,,,,,,,,,,,,,,,,,,,,,,,,,,,,,,,,,,,,,,,,,,,,,,,,,,,,,,,,,mpich2 License,mpich2,https://fedoraproject.org/wiki/Licensing/MIT,,,,mpich2.txt,,,,,,,,,,NEW-Fedora,,,,,,,,,,,,,,,,,,,,,,,,,,,,,,,,,,,,,,,,,,,,,,,,,,,,,,,,,,,,,,,,,,,,,,,,,,,,,,,,,,,,,,,,,,,,,,,,,,,,,,,,,,,,,,,,,,,,,,,,,,,,,,,,,,,,,,,,,,,,,,,,,,,,,,,,,,,,,,,,,,,,,,,,,,,,,,,,,,,,,,,,,,,,,,,,,,,,,,,,,,,,,,,,,,,,,,,,,,,,,,,,,,,,,,,,,,,,,,,Multics License,Multics,http://www.opensource.org/licenses/Multics,,YES,,Multics.txt,,,,,,,,,,,,,,,,,,,,,,,,,,,,,,,,,,,,,,,,,,,,,,,,,,,,,,,,,,,,,,,,,,,,,,,,,,,,,,,,,,,,,,,,,,,,,,,,,,,,,,,,,,,,,,,,,,,,,,,,,,,,,,,,,,,,,,,,,,,,,,,,,,,,,,,,,,,,,,,,,,,,,,,,,,,,,,,,,,,,,,,,,,,,,,,,,,,,,,,,,,,,,,,,,,,,,,,,,,,,,,,,,,,,,,,,,,,,,,,,,,,,,,,,,Mup License,Mup,https://fedoraproject.org/wiki/Licensing/Mup,,,,Mup.txt,,,,,,,NEW,,,,,,,,,,,,,,,,,,,,,,,,,,,,,,,,,,,,,,,,,,,,,,,,,,,,,,,,,,,,,,,,,,,,,,,,,,,,,,,,,,,,,,,,,,,,,,,,,,,,,,,,,,,,,,,,,,,,,,,,,,,,,,,,,,,,,,,,,,,,,,,,,,,,,,,,,,,,,,,,,,,,,,,,,,,,,,,,,,,,,,,,,,,,,,,,,,,,,,,,,,,,,,,,,,,,,,,,,,,,,,,,,,,,,,,,,,,,,,,,,,NASA Open Source Agreement 1.3,NASA-1.3,"http://ti.arc.nasa.gov/opensource/nosa/http://www.opensource.org/licenses/NASA-1.3",,YES,,NASA-1.3.txt,,,,,,,NEW,,,,,,,,,,,,,,,,,,,,,,,,,,,,,,,,,,,,,,,,,,,,,,,,,,,,,,,,,,,,,,,,,,,,,,,,,,,,,,,,,,,,,,,,,,,,,,,,,,,,,,,,,,,,,,,,,,,,,,,,,,,,,,,,,,,,,,,,,,,,,,,,,,,,,,,,,,,,,,,,,,,,,,,,,,,,,,,,,,,,,,,,,,,,,,,,,,,,,,,,,,,,,,,,,,,,,,,,,,,,,,,,,,,,,,,,,,,,,,,,,,Naumen Public License,Naumen,http://www.opensource.org/licenses/Naumen,,YES,,Naumen.txt,,,,,,,NEW,,,,,,,,,,,,,,,,,,,,,,,,,,,,,,,,,,,,,,,,,,,,,,,,,,,,,,,,,,,,,,,,,,,,,,,,,,,,,,,,,,,,,,,,,,,,,,,,,,,,,,,,,,,,,,,,,,,,,,,,,,,,,,,,,,,,,,,,,,,,,,,,,,,,,,,,,,,,,,,,,,,,,,,,,,,,,,,,,,,,,,,,,,,,,,,,,,,,,,,,,,,,,,,,,,,,,,,,,,,,,,,,,,,,,,,,,,,,,,,,,,Net Boolean Public License v1,NBPL-1.0,http://www.openldap.org/devel/gitweb.cgi?p=openldap.git;a=blob;f=LICENSE;hb=37b4b3f6cc4bf34e1d3dec61e69914b9819d8894,"This license was released 22 August 1998.This license was issued twice, but only with formatting differences.",,,NBPL-1.0.txt,,,,,,,,,,NEW-Fedora,,,,,,,,,,,,,,,,,,,,,,,,,,,,,,,,,,,,,,,,,,,,,,,,,,,,,,,,,,,,,,,,,,,,,,,,,,,,,,,,,,,,,,,,,,,,,,,,,,,,,,,,,,,,,,,,,,,,,,,,,,,,,,,,,,,,,,,,,,,,,,,,,,,,,,,,,,,,,,,,,,,,,,,,,,,,,,,,,,,,,,,,,,,,,,,,,,,,,,,,,,,,,,,,,,,,,,,,,,,,,,,,,,,,,,,,,,,,,,,NetCDF license,NetCDF,http://www.unidata.ucar.edu/software/netcdf/copyright.html,,,,NetCDF.txt,,,,,,,,,,NEW-Fedora,,,,,,,,,,,,,,,,,,,,,,,,,,,,,,,,,,,,,,,,,,,,,,,,,,,,,,,,,,,,,,,,,,,,,,,,,,,,,,,,,,,,,,,,,,,,,,,,,,,,,,,,,,,,,,,,,,,,,,,,,,,,,,,,,,,,,,,,,,,,,,,,,,,,,,,,,,,,,,,,,,,,,,,,,,,,,,,,,,,,,,,,,,,,,,,,,,,,,,,,,,,,,,,,,,,,,,,,,,,,,,,,,,,,,,,,,,,,,,,Nethack General Public License,NGPL,http://www.opensource.org/licenses/NGPL,,YES,,NGPL.txt,,,,,,OSI issue resolved (OSI website),,,,,,,,,,,,,,,,,,,,,,,,,,,,,,,,,,,,,,,,,,,,,,,,,,,,,,,,,,,,,,,,,,,,,,,,,,,,,,,,,,,,,,,,,,,,,,,,,,,,,,,,,,,,,,,,,,,,,,,,,,,,,,,,,,,,,,,,,,,,,,,,,,,,,,,,,,,,,,,,,,,,,,,,,,,,,,,,,,,,,,,,,,,,,,,,,,,,,,,,,,,,,,,,,,,,,,,,,,,,,,,,,,,,,,,,,,,,,,,,,,,Netizen Open Source License,NOSL,http://bits.netizen.com.au/licenses/NOSL/nosl.txt,,,"The contents of this file are subject to the Netizen Open Source License Version 1.0 (the ""License""); you may not use this file except in compliance with the License. You may obtain a copy of the License at http://netizen.com.au/licenses/NOPL/ Software distributed under the License is distributed on an ""AS IS"" basis, WITHOUT WARRANTY OF ANY KIND, either express or implied. See the License for the specific language governing rights and limitations under the License. The Original Code is ______________________________________. The Initial Developer of the Original Code is ________________________. Portions created by ______________________ are Copyright (C) ______ _______________________. All Rights Reserved. Contributor(s): ______________________________________. Alternatively, the contents of this file may be used under the terms of the _____ license (the ""[___] License""), in which case the provisions of [______] License are applicable instead of those above. If you wish to allow use of your version of this file only under the terms of the [____] License and not to allow others to use your version of this file under the NOSL, indicate your decision by deleting the provisions above and replace them with the notice and other provisions required by the [___] License. If you do not delete the provisions above, a recipient may use your version of this file under either the NOSL or the [___] License.",NOSL.txt,,,,,,,,,,,,,,,,,,,,,,,,,,,,,,,,,,,,,,,,,,,,,,,,,,,,,,,,,,,,,,,,,,,,,,,,,,,,,,,,,,,,,,,,,,,,,,,,,,,,,,,,,,,,,,,,,,,,,,,,,,,,,,,,,,,,,,,,,,,,,,,,,,,,,,,,,,,,,,,,,,,,,,,,,,,,,,,,,,,,,,,,,,,,,,,,,,,,,,,,,,,,,,,,,,,,,,,,,,,,,,,,,,,,,,,,,,,,,,,,,,,,,,,,,Netscape Public License v1.0,NPL-1.0,http://www.mozilla.org/MPL/NPL/1.0/,,,,NPL-1.0.txt,,,,,,,,,,NEW-Fedora,,,,,,,,,,,,,,,,,,,,,,,,,,,,,,,,,,,,,,,,,,,,,,,,,,,,,,,,,,,,,,,,,,,,,,,,,,,,,,,,,,,,,,,,,,,,,,,,,,,,,,,,,,,,,,,,,,,,,,,,,,,,,,,,,,,,,,,,,,,,,,,,,,,,,,,,,,,,,,,,,,,,,,,,,,,,,,,,,,,,,,,,,,,,,,,,,,,,,,,,,,,,,,,,,,,,,,,,,,,,,,,,,,,,,,,,,,,,,,,Netscape Public License v1.1,NPL-1.1,http://www.mozilla.org/MPL/NPL/1.1/,,,"The contents of this file are subject to the Netscape Public License Version 1.0 (the ""License""); you may not use this file except in compliance with the License. You may obtain a copy of the License at http://www.mozilla.org/NPL/Software distributed under the License is distributed on an ""AS IS"" basis, WITHOUT WARRANTY OF ANY KIND, either express or implied. See the License for the specific language governing rights and limitations under the License.The Original Code is Mozilla Communicator client code, released March 31, 1998.The Initial Developer of the Original Code is Netscape Communications Corporation. Portions created by Netscape are Copyright (C) 1998 Netscape Communications Corporation. All Rights Reserved.Contributor(s): ______________________________________.",NPL-1.1.txt,,,,,,,,,,NEW-Fedora,,,,,,,,,,,,,,,,,,,,,,,,,,,,,,,,,,,,,,,,,,,,,,,,,,,,,,,,,,,,,,,,,,,,,,,,,,,,,,,,,,,,,,,,,,,,,,,,,,,,,,,,,,,,,,,,,,,,,,,,,,,,,,,,,,,,,,,,,,,,,,,,,,,,,,,,,,,,,,,,,,,,,,,,,,,,,,,,,,,,,,,,,,,,,,,,,,,,,,,,,,,,,,,,,,,,,,,,,,,,,,,,,,,,,,,,,,,,,,,Newsletr License,Newsletr,https://fedoraproject.org/wiki/Licensing/Newsletr,,,,Newsletr.txt,,,,YES,,,,,,,,,,,,,,,,,,,,,,,,,,,,,,,,,,,,,,,,,,,,,,,,,,,,,,,,,,,,,,,,,,,,,,,,,,,,,,,,,,,,,,,,,,,,,,,,,,,,,,,,,,,,,,,,,,,,,,,,,,,,,,,,,,,,,,,,,,,,,,,,,,,,,,,,,,,,,,,,,,,,,,,,,,,,,,,,,,,,,,,,,,,,,,,,,,,,,,,,,,,,,,,,,,,,,,,,,,,,,,,,,,,,,,,,,,,,,,,,,,,,,No Limit Public License,NLPL,https://fedoraproject.org/wiki/Licensing/NLPL,,,,NLPL.txt,,,,,,,,,,NEW-Fedora,,,,,,,,,,,,,,,,,,,,,,,,,,,,,,,,,,,,,,,,,,,,,,,,,,,,,,,,,,,,,,,,,,,,,,,,,,,,,,,,,,,,,,,,,,,,,,,,,,,,,,,,,,,,,,,,,,,,,,,,,,,,,,,,,,,,,,,,,,,,,,,,,,,,,,,,,,,,,,,,,,,,,,,,,,,,,,,,,,,,,,,,,,,,,,,,,,,,,,,,,,,,,,,,,,,,,,,,,,,,,,,,,,,,,,,,,,,,,,,Nokia Open Source License,Nokia,http://www.opensource.org/licenses/nokia,,YES,,Nokia.txt,,,,H-YES,,,,,,,,,,,added markup to standard header,,,,,,,,,,,,,,,,,,,,,,,,,,,,,,,,,,,,,,,,,,,,,,,,,,,,,,,,,,,,,,,,,,,,,,,,,,,,,,,,,,,,,,,,,,,,,,,,,,,,,,,,,,,,,,,,,,,,,,,,,,,,,,,,,,,,,,,,,,,,,,,,,,,,,,,,,,,,,,,,,,,,,,,,,,,,,,,,,,,,,,,,,,,,,,,,,,,,,,,,,,,,,,,,,,,,,,,,,,,,,,,,,,,,,,,,,,Non-Profit Open Software License 3.0,NPOSL-3.0,http://www.opensource.org/licenses/NOSL3.0,,YES,Licensed under the Non-Profit Open Software License version 3.0,NPOSL-3.0.txt,,,,,,,,,,,,,,,,,,,,,,,,,,,,,,,,,,,,,,,,,,,,,,,,,,,,,,,,,,,,,,,,,,,,,,,,,,,,,,,,,,,,,,,,,,,,,,,,,,,,,,,,,,,,,,,,,,,,,,,,,,,,,,,,,,,,,,,,,,,,,,,,,,,,,,,,,,,,,,,,,,,,,,,,,,,,,,,,,,,,,,,,,,,,,,,,,,,,,,,,,,,,,,,,,,,,,,,,,,,,,,,,,,,,,,,,,,,,,,,,,,,,,,,,,Norwegian Licence for Open Government Data,NLOD-1.0,http://data.norge.no/nlod/en/1.0,Norwegian translation available here: http://data.norge.no/nlod/no/1.0,,,NLOD-1.0.txt,,,,,,,,,,,,,,,,,,,,,,,,,,,,,,,,,,,,,,,,,,,,,,,,,,,,,,,,,,,,,,,,,,,,,,,,,,,,,,,,,,,,,,,,,,,,,,,,,,,,,,,,,,,,,,,,,,,,,,,,,,,,,,,,,,,,,,,,,,,,,,,,,,,,,,,,,,,,,,,,,,,,,,,,,,,,,,,,,,,,,,,,,,,,,,,,,,,,,,,,,,,,,,,,,,,,,,,,,,,,,,,,,,,,,,,,,,,,,,,,,,,,,,,,,Noweb License,Noweb,https://fedoraproject.org/wiki/Licensing/Noweb,,,,Noweb.txt,,,,,,,,,,,,,,,NEW,,,,,,,,,,,,,,,,,,,,,,,,,,,,,,,,,,,,,,,,,,,,,,,,,,,,,,,,,,,,,,,,,,,,,,,,,,,,,,,,,,,,,,,,,,,,,,,,,,,,,,,,,,,,,,,,,,,,,,,,,,,,,,,,,,,,,,,,,,,,,,,,,,,,,,,,,,,,,,,,,,,,,,,,,,,,,,,,,,,,,,,,,,,,,,,,,,,,,,,,,,,,,,,,,,,,,,,,,,,,,,,,,,,,,,,,,,NRL License,NRL,http://web.mit.edu/network/isakmp/nrllicense.html,,,,NRL.txt,,,,,,,,,,,,,,,,,,,,,,,,,,,,,,,,,,,,,,,,,,,,,,,,,,,,,,,,,,,,,,,,,,,,,,,,,,,,,,,,,,,,,,,,,,,,,,,,,,,,,,,,,,,,,,,,,,,,,,,,,,,,,,,,,,,,,,,,,,,,,,,,,,,,,,,,,,,,,,,,,,,,,,,,,,,,,,,,,,,,,,,,,,,,,,,,,,,,,,,,,,,,,,,,,,,,,,,,,,,,,,,,,,,,,,,,,,,,,,,,,,,,,,,,,NTP License,NTP,http://www.opensource.org/licenses/NTP,,YES,,NTP.txt,,,,,,,NEW,,,,,,,,,,,,,,,,,,,,,,,,,,,,,,,,,,,,,,,,,,,,,,,,,,,,,,,,,,,,,,,,,,,,,,,,,,,,,,,,,,,,,,,,,,,,,,,,,,,,,,,,,,,,,,,,,,,,,,,,,,,,,,,,,,,,,,,,,,,,,,,,,,,,,,,,,,,,,,,,,,,,,,,,,,,,,,,,,,,,,,,,,,,,,,,,,,,,,,,,,,,,,,,,,,,,,,,,,,,,,,,,,,,,,,,,,,,,,,,,,,Nunit License,Nunit,https://fedoraproject.org/wiki/Licensing/Nunit,,,,Nunit.txt,,,,,,,NEW,,,,,,,,,,,,,,,,,,,,,,,,,,,,,,,,,,,,,,,,,,,,,,,,,,,,,,,,,,,,,,,,,,,,,,,,,,,,,,,,,,,,,,,,,,,,,,,,,,,,,,,,,,,,,,,,,,,,,,,,,,,,,,,,,,,,,,,,,,,,,,,,,,,,,,,,,,,,,,,,,,,,,,,,,,,,,,,,,,,,,,,,,,,,,,,,,,,,,,,,,,,,,,,,,,,,,,,,,,,,,,,,,,,,,,,,,,,,,,,,,,OCLC Research Public License 2.0,OCLC-2.0,"http://www.oclc.org/research/activities/software/license/v2final.htmhttp://www.opensource.org/licenses/OCLC-2.0",This license was released: May 2002,YES,"Copyright (c) 2000-<<var;name=year;original=(insert then current year);match=.+>>. OCLC Online Computer Library Center, Inc. and other contributors. All rights reserved. The contents of this file, as updated from time to time by the OCLC Office of Research, are subject to OCLC Research Public License Version 2.0 (the ""License""); you may not use this file except in compliance with the License. You may obtain a current copy of the License at http://purl.oclc.org/oclc/research/ORPL/. Software distributed under the License is distributed on an ""AS IS"" basis, WITHOUT WARRANTY OF ANY KIND, either express or implied. See the License for the specific language governing rights and limitations under the License. This software consists of voluntary contributions made by many individuals on behalf of OCLC Research. For more information on OCLC Research, please see http://www.oclc.org/research/. The Original Code is <<var;name=code;original=_____;match=.+>>.. The Initial Developer of the Original Code is <<var;name=InitialDeveloper;original=_____;match=.+>>. Portions created by <<var;name=createdby;original=_____;match=.+>> are Copyright (C)  <<var;name=copyright;original=_____;match=.+>>. All Rights Reserved. Contributor(s): <<var;name=contributor;original=_____;match=.+>>.",OCLC-2.0.txt,,,,,,,NEW,,,,,,,,,,,,,,,,,,,,,,,,,,,,,,,,,,,,,,,,,,,,,,,,,,,,,,,,,,,,,,,,,,,,,,,,,,,,,,,,,,,,,,,,,,,,,,,,,,,,,,,,,,,,,,,,,,,,,,,,,,,,,,,,,,,,,,,,,,,,,,,,,,,,,,,,,,,,,,,,,,,,,,,,,,,,,,,,,,,,,,,,,,,,,,,,,,,,,,,,,,,,,,,,,,,,,,,,,,,,,,,,,,,,,,,,,,,,,,,,,,ODC Open Database License v1.0,ODbL-1.0,http://www.opendatacommons.org/licenses/odbl/1.0/,,,,ODbL-1.0.txt,,,,,,,NEW,,,,,,,,,,,,,,,,,,,,,,,,,,,,,,,,,,,,,,,,,,,,,,,,,,,,,,,,,,,,,,,,,,,,,,,,,,,,,,,,,,,,,,,,,,,,,,,,,,,,,,,,,,,,,,,,,,,,,,,,,,,,,,,,,,,,,,,,,,,,,,,,,,,,,,,,,,,,,,,,,,,,,,,,,,,,,,,,,,,,,,,,,,,,,,,,,,,,,,,,,,,,,,,,,,,,,,,,,,,,,,,,,,,,,,,,,,,,,,,,,,ODC Public Domain Dedication & License 1.0,PDDL-1.0,http://opendatacommons.org/licenses/pddl/1.0/,,,,PDDL-1.0.txt,,,,,,,NEW,,,,,,,,,,,,,,,,,,,,,,,,,,,,,,,,,,,,,,,,,,,,,,,,,,,,,,,,,,,,,,,,,,,,,,,,,,,,,,,,,,,,,,,,,,,,,,,,,,,,,,,,,,,,,,,,,,,,,,,,,,,,,,,,,,,,,,,,,,,,,,,,,,,,,,,,,,,,,,,,,,,,,,,,,,,,,,,,,,,,,,,,,,,,,,,,,,,,,,,,,,,,,,,,,,,,,,,,,,,,,,,,,,,,,,,,,,,,,,,,,,Open CASCADE Technology Public License,OCCT-PL,http://www.opencascade.com/content/occt-public-license,,,,OCCT-PL.txt,,,,,,,NEW,,,,,,,,,,,,,,,,,,,,,,,,,,,,,,,,,,,,,,,,,,,,,,,,,,,,,,,,,,,,,,,,,,,,,,,,,,,,,,,,,,,,,,,,,,,,,,,,,,,,,,,,,,,,,,,,,,,,,,,,,,,,,,,,,,,,,,,,,,,,,,,,,,,,,,,,,,,,,,,,,,,,,,,,,,,,,,,,,,,,,,,,,,,,,,,,,,,,,,,,,,,,,,,,,,,,,,,,,,,,,,,,,,,,,,,,,,,,,,,,,,Open Group Test Suite License,OGTSL,"http://www.opengroup.org/testing/downloads/The_Open_Group_TSL.txthttp://www.opensource.org/licenses/OGTSL",,YES,,OGTSL.txt,,,,,,,NEW,,,,,,,,,,,,,,,,,,,,,,,,,,,,,,,,,,,,,,,,,,,,,,,,,,,,,,,,,,,,,,,,,,,,,,,,,,,,,,,,,,,,,,,,,,,,,,,,,,,,,,,,,,,,,,,,,,,,,,,,,,,,,,,,,,,,,,,,,,,,,,,,,,,,,,,,,,,,,,,,,,,,,,,,,,,,,,,,,,,,,,,,,,,,,,,,,,,,,,,,,,,,,,,,,,,,,,,,,,,,,,,,,,,,,,,,,,,,,,,,,,Open LDAP Public License  2.2.2,OLDAP-2.2.2,http://www.openldap.org/devel/gitweb.cgi?p=openldap.git;a=blob;f=LICENSE;hb=df2cc1e21eb7c160695f5b7cffd6296c151ba188,This license was released 28 July 2000.,,,OLDAP-2.2.2.txt,,,,,,,NEW,,,,,,,,,,,,,,,,,,,,,,,,,,,,,,,,,,,,,,,,,,,,,,,,,,,,,,,,,,,,,,,,,,,,,,,,,,,,,,,,,,,,,,,,,,,,,,,,,,,,,,,,,,,,,,,,,,,,,,,,,,,,,,,,,,,,,,,,,,,,,,,,,,,,,,,,,,,,,,,,,,,,,,,,,,,,,,,,,,,,,,,,,,,,,,,,,,,,,,,,,,,,,,,,,,,,,,,,,,,,,,,,,,,,,,,,,,,,,,,,,,Open LDAP Public License v1.1,OLDAP-1.1,http://www.openldap.org/devel/gitweb.cgi?p=openldap.git;a=blob;f=LICENSE;hb=806557a5ad59804ef3a44d5abfbe91d706b0791f,This license was released 25 August 1998.,,,OLDAP-1.1.txt,,,,,,,NEW,,,,,,,,,,,,,,,,,,,,,,,,,,,,,,,,,,,,,,,,,,,,,,,,,,,,,,,,,,,,,,,,,,,,,,,,,,,,,,,,,,,,,,,,,,,,,,,,,,,,,,,,,,,,,,,,,,,,,,,,,,,,,,,,,,,,,,,,,,,,,,,,,,,,,,,,,,,,,,,,,,,,,,,,,,,,,,,,,,,,,,,,,,,,,,,,,,,,,,,,,,,,,,,,,,,,,,,,,,,,,,,,,,,,,,,,,,,,,,,,,,