Open LDAP Public License v1.2,OLDAP-1.2,http://www.openldap.org/devel/gitweb.cgi?p=openldap.git;a=blob;f=LICENSE;hb=42b0383c50c299977b5893ee695cf4e486fb0dc7,"This license was released 1 September 1998.This license was issued four time, but only with formatting differences.",,,OLDAP-1.2.txt,,,,,,,NEW,,,,,,,,,,,,,,,,,,,,,,,,,,,,,,,,,,,,,,,,,,,,,,,,,,,,,,,,,,,,,,,,,,,,,,,,,,,,,,,,,,,,,,,,,,,,,,,,,,,,,,,,,,,,,,,,,,,,,,,,,,,,,,,,,,,,,,,,,,,,,,,,,,,,,,,,,,,,,,,,,,,,,,,,,,,,,,,,,,,,,,,,,,,,,,,,,,,,,,,,,,,,,,,,,,,,,,,,,,,,,,,,,,,,,,,,,,,,,,,,,,Open LDAP Public License v1.3,OLDAP-1.3,http://www.openldap.org/devel/gitweb.cgi?p=openldap.git;a=blob;f=LICENSE;hb=e5f8117f0ce088d0bd7a8e18ddf37eaa40eb09b1,"This license was released 17 January 1999.This license was issued twice in the same day with a minor correction.  This is the corrected (second) version.",,,OLDAP-1.3.txt,,,,,,,NEW,,,,,,,,,,,,,,,,,,,,,,,,,,,,,,,,,,,,,,,,,,,,,,,,,,,,,,,,,,,,,,,,,,,,,,,,,,,,,,,,,,,,,,,,,,,,,,,,,,,,,,,,,,,,,,,,,,,,,,,,,,,,,,,,,,,,,,,,,,,,,,,,,,,,,,,,,,,,,,,,,,,,,,,,,,,,,,,,,,,,,,,,,,,,,,,,,,,,,,,,,,,,,,,,,,,,,,,,,,,,,,,,,,,,,,,,,,,,,,,,,,Open LDAP Public License v1.4,OLDAP-1.4,http://www.openldap.org/devel/gitweb.cgi?p=openldap.git;a=blob;f=LICENSE;hb=c9f95c2f3f2ffb5e0ae55fe7388af75547660941,This license was released 18 January 1999.,,,OLDAP-1.4.txt,,,,,,,NEW,,,,,,,,,,,,,,,,,,,,,,,,,,,,,,,,,,,,,,,,,,,,,,,,,,,,,,,,,,,,,,,,,,,,,,,,,,,,,,,,,,,,,,,,,,,,,,,,,,,,,,,,,,,,,,,,,,,,,,,,,,,,,,,,,,,,,,,,,,,,,,,,,,,,,,,,,,,,,,,,,,,,,,,,,,,,,,,,,,,,,,,,,,,,,,,,,,,,,,,,,,,,,,,,,,,,,,,,,,,,,,,,,,,,,,,,,,,,,,,,,,Open LDAP Public License v2.0 (or possibly 2.0A and 2.0B),OLDAP-2.0,http://www.openldap.org/devel/gitweb.cgi?p=openldap.git;a=blob;f=LICENSE;hb=cbf50f4e1185a21abd4c0a54d3f4341fe28f36ea,This license was released 7 June 1999.,,,OLDAP-2.0.txt,,,,,,,NEW,,,,,,,,,,,,,,,,,,,,,,,,,,,,,,,,,,,,,,,,,,,,,,,,,,,,,,,,,,,,,,,,,,,,,,,,,,,,,,,,,,,,,,,,,,,,,,,,,,,,,,,,,,,,,,,,,,,,,,,,,,,,,,,,,,,,,,,,,,,,,,,,,,,,,,,,,,,,,,,,,,,,,,,,,,,,,,,,,,,,,,,,,,,,,,,,,,,,,,,,,,,,,,,,,,,,,,,,,,,,,,,,,,,,,,,,,,,,,,,,,,Open LDAP Public License v2.0.1,OLDAP-2.0.1,http://www.openldap.org/devel/gitweb.cgi?p=openldap.git;a=blob;f=LICENSE;hb=b6d68acd14e51ca3aab4428bf26522aa74873f0e,"This license was released 21 December 1999.This license is the same as 2.0 with the word ""registered"" removed from in front of ""trademark.""",,,OLDAP-2.0.1.txt,,,,,,,NEW,,,,,,,,,,,,,,,,,,,,,,,,,,,,,,,,,,,,,,,,,,,,,,,,,,,,,,,,,,,,,,,,,,,,,,,,,,,,,,,,,,,,,,,,,,,,,,,,,,,,,,,,,,,,,,,,,,,,,,,,,,,,,,,,,,,,,,,,,,,,,,,,,,,,,,,,,,,,,,,,,,,,,,,,,,,,,,,,,,,,,,,,,,,,,,,,,,,,,,,,,,,,,,,,,,,,,,,,,,,,,,,,,,,,,,,,,,,,,,,,,,Open LDAP Public License v2.1,OLDAP-2.1,http://www.openldap.org/devel/gitweb.cgi?p=openldap.git;a=blob;f=LICENSE;hb=b0d176738e96a0d3b9f85cb51e140a86f21be715,This license was released 29 February 2000.,,,OLDAP-2.1.txt,,,,,,,NEW,,,,,,,,,,,,,,,,,,,,,,,,,,,,,,,,,,,,,,,,,,,,,,,,,,,,,,,,,,,,,,,,,,,,,,,,,,,,,,,,,,,,,,,,,,,,,,,,,,,,,,,,,,,,,,,,,,,,,,,,,,,,,,,,,,,,,,,,,,,,,,,,,,,,,,,,,,,,,,,,,,,,,,,,,,,,,,,,,,,,,,,,,,,,,,,,,,,,,,,,,,,,,,,,,,,,,,,,,,,,,,,,,,,,,,,,,,,,,,,,,,Open LDAP Public License v2.2,OLDAP-2.2,http://www.openldap.org/devel/gitweb.cgi?p=openldap.git;a=blob;f=LICENSE;hb=470b0c18ec67621c85881b2733057fecf4a1acc3,This license was released 1 March 2000.,,,OLDAP-2.2.txt,,,,,,,,,,,,,,,,,,,,,,,,,,,,,,,,,,,,,,,,,,,,,,,,,,,,,,,,,,,,,,,,,,,,,,,,,,,,,,,,,,,,,,,,,,,,,,,,,,,,,,,,,,,,,,,,,,,,,,,,,,,,,,,,,,,,,,,,,,,,,,,,,,,,,,,,,,,,,,,,,,,,,,,,,,,,,,,,,,,,,,,,,,,,,,,,,,,,,,,,,,,,,,,,,,,,,,,,,,,,,,,,,,,,,,,,,,,,,,,,,,,,,,,,,Open LDAP Public License v2.2.1,OLDAP-2.2.1,http://www.openldap.org/devel/gitweb.cgi?p=openldap.git;a=blob;f=LICENSE;hb=4bc786f34b50aa301be6f5600f58a980070f481e,This license was released 1 March 2000.,,,OLDAP-2.2.1.txt,,,,,,,,,,NEW-Fedora,,,,,,,,,,,,,,,,,,,,,,,,,,,,,,,,,,,,,,,,,,,,,,,,,,,,,,,,,,,,,,,,,,,,,,,,,,,,,,,,,,,,,,,,,,,,,,,,,,,,,,,,,,,,,,,,,,,,,,,,,,,,,,,,,,,,,,,,,,,,,,,,,,,,,,,,,,,,,,,,,,,,,,,,,,,,,,,,,,,,,,,,,,,,,,,,,,,,,,,,,,,,,,,,,,,,,,,,,,,,,,,,,,,,,,,,,,,,,,,Open LDAP Public License v2.3,OLDAP-2.3,http://www.openldap.org/devel/gitweb.cgi?p=openldap.git;a=blob;f=LICENSE;hb=d32cf54a32d581ab475d23c810b0a7fbaf8d63c3,This license was released 28 July 2000.,,,OLDAP-2.3.txt,,,,,,,NEW,,,,,,,,,,,,,,,,,,,,,,,,,,,,,,,,,,,,,,,,,,,,,,,,,,,,,,,,,,,,,,,,,,,,,,,,,,,,,,,,,,,,,,,,,,,,,,,,,,,,,,,,,,,,,,,,,,,,,,,,,,,,,,,,,,,,,,,,,,,,,,,,,,,,,,,,,,,,,,,,,,,,,,,,,,,,,,,,,,,,,,,,,,,,,,,,,,,,,,,,,,,,,,,,,,,,,,,,,,,,,,,,,,,,,,,,,,,,,,,,,,Open LDAP Public License v2.4,OLDAP-2.4,http://www.openldap.org/devel/gitweb.cgi?p=openldap.git;a=blob;f=LICENSE;hb=cd1284c4a91a8a380d904eee68d1583f989ed386,This license was released 8 December 2000.,,,OLDAP-2.4.txt,,,,,may need to update OSI link later,,,OSI url updated,,,,,,,,,,,,,,,,,,,,,,,,,,,,,,,,,,,,,,,,,,,,,,,,,,,,,,,,,,,,,,,,,,,,,,,,,,,,,,,,,,,,,,,,,,,,,,,,,,,,,,,,,,,,,,,,,,,,,,,,,,,,,,,,,,,,,,,,,,,,,,,,,,,,,,,,,,,,,,,,,,,,,,,,,,,,,,,,,,,,,,,,,,,,,,,,,,,,,,,,,,,,,,,,,,,,,,,,,,,,,,,,,,,,,,,,,,,,,,,,,Open LDAP Public License v2.5,OLDAP-2.5,http://www.openldap.org/devel/gitweb.cgi?p=openldap.git;a=blob;f=LICENSE;hb=6852b9d90022e8593c98205413380536b1b5a7cf,This license was released 11 May 2001.,,,OLDAP-2.5.txt,,,,,,,,,,NEW-Fedora,,,,,,,,,,,,,,,,,,,,,,,,,,,,,,,,,,,,,,,,,,,,,,,,,,,,,,,,,,,,,,,,,,,,,,,,,,,,,,,,,,,,,,,,,,,,,,,,,,,,,,,,,,,,,,,,,,,,,,,,,,,,,,,,,,,,,,,,,,,,,,,,,,,,,,,,,,,,,,,,,,,,,,,,,,,,,,,,,,,,,,,,,,,,,,,,,,,,,,,,,,,,,,,,,,,,,,,,,,,,,,,,,,,,,,,,,,,,,,,Open LDAP Public License v2.6,OLDAP-2.6,http://www.openldap.org/devel/gitweb.cgi?p=openldap.git;a=blob;f=LICENSE;hb=1cae062821881f41b73012ba816434897abf4205,This license was released 14 June 2001.,,,OLDAP-2.6.txt,,,,,still not on OSI site?,OSI issue resolved - is OSI approved;,,,,,,,,,,,,,,,,,,,,,,,,,,,,,,,,,,,,,,,,,,,,,,,,,,,,,,,,,,,,,,,,,,,,,,,,,,,,,,,,,,,,,,,,,,,,,,,,,,,,,,,,,,,,,,,,,,,,,,,,,,,,,,,,,,,,,,,,,,,,,,,,,,,,,,,,,,,,,,,,,,,,,,,,,,,,,,,,,,,,,,,,,,,,,,,,,,,,,,,,,,,,,,,,,,,,,,,,,,,,,,,,,,,,,,,,,,,,,,,,,,,Open LDAP Public License v2.7,OLDAP-2.7,http://www.openldap.org/devel/gitweb.cgi?p=openldap.git;a=blob;f=LICENSE;hb=47c2415c1df81556eeb39be6cad458ef87c534a2,This license was released 7 September 2001.,,,OLDAP-2.7.txt,,,,,may need to update OSI link later,OSI issue resolved - is OSI approved;,,OSI url updated,,,,,,,,,,,,,,,,,,,,,,,,,,,,,,,,,,,,,,,,,,,,,,,,,,,,,,,,,,,,,,,,,,,,,,,,,,,,,,,,,,,,,,,,,,,,,,,,,,,,,,,,,,,,,,,,,,,,,,,,,,,,,,,,,,,,,,,,,,,,,,,,,,,,,,,,,,,,,,,,,,,,,,,,,,,,,,,,,,,,,,,,,,,,,,,,,,,,,,,,,,,,,,,,,,,,,,,,,,,,,,,,,,,,,,,,,,,,,,,,,Open LDAP Public License v2.8,OLDAP-2.8,http://www.openldap.org/software/release/license.html,,,,OLDAP-2.8.txt,,,,,,,,,,,,,,,,,,,,,,,,,,,,,,,,,,,,,,,,,,,,,,,,,,,,,,,,,,,,,,,,,,,,,,,,,,,,,,,,,,,,,,,,,,,,,,,,,,,,,,,,,,,,,,,,,,,,,,,,,,,,,,,,,,,,,,,,,,,,,,,,,,,,,,,,,,,,,,,,,,,,,,,,,,,,,,,,,,,,,,,,,,,,,,,,,,,,,,,,,,,,,,,,,,,,,,,,,,,,,,,,,,,,,,,,,,,,,,,,,,,,,,,,,Open Market License,OML,https://fedoraproject.org/wiki/Licensing/Open_Market_License,,,,OML.txt,,,,,,,,,,,,,,,,,,,,,,,,,,,,,,,,,,,,,,,,,,,,,,,,,,,,,,,,,,,,,,,,,,,,,,,,,,,,,,,,,,,,,,,,,,,,,,,,,,,,,,,,,,,,,,,,,,,,,,,,,,,,,,,,,,,,,,,,,,,,,,,,,,,,,,,,,,,,,,,,,,,,,,,,,,,,,,,,,,,,,,,,,,,,,,,,,,,,,,,,,,,,,,,,,,,,,,,,,,,,,,,,,,,,,,,,,,,,,,,,,,,,,,,,,Open Public License v1.0,OPL-1.0,"http://old.koalateam.com/jackaroo/OPL_1_0.TXThttps://fedoraproject.org/wiki/Licensing/Open_Public_License",,,,OPL-1.0.txt,,,,,,,,,"license text was for v3.01, fixed .txt file so will display properly on website",,,,,,,,,,,,,,,,,,,,,,,,,,,,,,,,,,,,,,,,,,,,,,,,,,,,,,,,,,,,,,,,,,,,,,,,,,,,,,,,,,,,,,,,,,,,,,,,,,,,,,,,,,,,,,,,,,,,,,,,,,,,,,,,,,,,,,,,,,,,,,,,,,,,,,,,,,,,,,,,,,,,,,,,,,,,,,,,,,,,,,,,,,,,,,,,,,,,,,,,,,,,,,,,,,,,,,,,,,,,,,,,,,,,,,,,,,,,,,,,Open Software License 1.0,OSL-1.0,http://opensource.org/licenses/OSL-1.0,This license has been superseded.,YES,,OSL-1.0.txt,,,,,,,Text file updated and filename for text file added (was missing),,,,,,,,,,,,,,,,,,,,,,,,,,,,,,,,,,,,,,,,,,,,,,,,,,,,,,,,,,,,,,,,,,,,,,,,,,,,,,,,,,,,,,,,,,,,,,,,,,,,,,,,,,,,,,,,,,,,,,,,,,,,,,,,,,,,,,,,,,,,,,,,,,,,,,,,,,,,,,,,,,,,,,,,,,,,,,,,,,,,,,,,,,,,,,,,,,,,,,,,,,,,,,,,,,,,,,,,,,,,,,,,,,,,,,,,,,,,,,,,,,Open Software License 1.1,OSL-1.1,https://fedoraproject.org/wiki/Licensing/OSL1.1,,,,OSL-1.1.txt,,,,YES,,,,,,NEW-Fedora,,,,,markup and note added to license,,,,,,,,,,,,,,,,,,,,,,,,,,,,,,,,,,,,,,,,,,,,,,,,,,,,,,,,,,,,,,,,,,,,,,,,,,,,,,,,,,,,,,,,,,,,,,,,,,,,,,,,,,,,,,,,,,,,,,,,,,,,,,,,,,,,,,,,,,,,,,,,,,,,,,,,,,,,,,,,,,,,,,,,,,,,,,,,,,,,,,,,,,,,,,,,,,,,,,,,,,,,,,,,,,,,,,,,,,,,,,,,,,,,,,,,,,Open Software License 2.0,OSL-2.0,http://web.archive.org/web/20041020171434/http://www.rosenlaw.com/osl2.0.html,,YES,,OSL-2.0.txt,,,,,,,,,,,,,,,,,,,,,,,,,,,,,,,,,,,,,,,,,,,,,,,,,,,,,,,,,,,,,,,,,,,,,,,,,,,,,,,,,,,,,,,,,,,,,,,,,,,,,,,,,,,,,,,,,,,,,,,,,,,,,,,,,,,,,,,,,,,,,,,,,,,,,,,,,,,,,,,,,,,,,,,,,,,,,,,,,,,,,,,,,,,,,,,,,,,,,,,,,,,,,,,,,,,,,,,,,,,,,,,,,,,,,,,,,,,,,,,,,,,,,,,,,Open Software License 2.1,OSL-2.1,"http://opensource.org/licenses/OSL-2.1http://web.archive.org/web/20050212003940/http://www.rosenlaw.com/osl21.htm",Same as version 2.0 of this license except with changes to section 10,YES,,OSL-2.1.txt,,,,,,,,,,NEW-Fedora,,,,,,,,,,,,,,,,,,,,,,,,,,,,,,,,,,,,,,,,,,,,,,,,,,,,,,,,,,,,,,,,,,,,,,,,,,,,,,,,,,,,,,,,,,,,,,,,,,,,,,,,,,,,,,,,,,,,,,,,,,,,,,,,,,,,,,,,,,,,,,,,,,,,,,,,,,,,,,,,,,,,,,,,,,,,,,,,,,,,,,,,,,,,,,,,,,,,,,,,,,,,,,,,,,,,,,,,,,,,,,,,,,,,,,,,,,,,,,,Open Software License 3.0,OSL-3.0,"http://www.rosenlaw.com/OSL3.0.htmhttp://www.opensource.org/licenses/OSL-3.0",,YES,,OSL-3.0.txt,,,,,,,,,,NEW-Fedora,,,,,,,,,,,,,,,,,,,,,,,,,,,,,,,,,,,,,,,,,,,,,,,,,,,,,,,,,,,,,,,,,,,,,,,,,,,,,,,,,,,,,,,,,,,,,,,,,,,,,,,,,,,,,,,,,,,,,,,,,,,,,,,,,,,,,,,,,,,,,,,,,,,,,,,,,,,,,,,,,,,,,,,,,,,,,,,,,,,,,,,,,,,,,,,,,,,,,,,,,,,,,,,,,,,,,,,,,,,,,,,,,,,,,,,,,,,,,,,OpenSSL License,OpenSSL,http://www.openssl.org/source/license.html,"The OpenSSL toolkit stays under a dual license, i.e. both the conditions of the OpenSSL License and the original SSLeay license apply to the toolkit.",,,OpenSSL.txt,,,,,,,,,,,,,,,,,,,,,,,,,,,,,,,,,,,,,,,,,,,,,,,,,,,,,,,,,,,,,,,,,,,,,,,,,,,,,,,,,,,,,,,,,,,,,,,,,,,,,,,,,,,,,,,,,,,,,,,,,,,,,,,,,,,,,,,,,,,,,,,,,,,,,,,,,,,,,,,,,,,,,,,,,,,,,,,,,,,,,,,,,,,,,,,,,,,,,,,,,,,,,,,,,,,,,,,,,,,,,,,,,,,,,,,,,,,,,,,,,,,,,,,,,OSET Public License version 2.1,OSET-PL-2.1,"http://opensource.org/licenses/OPL-2.1http://www.osetfoundation.org/public-license/#",,YES,,OSET-PL-2.1.txt,,,,,,,,,,,,,,,,,,,,,,,,,,,,,,,,,,,,,,,,,,,,,,,,,,,,,,,,,,,,,,,,,,,,,,,,,,,,,,,,,,,,,,,,,,,,,,,,,,,,,,,,,,,,,,,,,,,,,,,,,,,,,,,,,,,,,,,,,,,,,,,,,,,,,,,,,,,,,,,,,,,,,,,,,,,,,,,,,,,,,,,,,,,,,,,,,,,,,,,,,,,,,,,,,,,,,,,,,,,,,,,,,,,,,,,,,,,,,,,,,,,,,,,,,PHP License v3.0,PHP-3.0,"http://www.opensource.org/licenses/PHP-3.0http://www.php.net/license/3_0.txt",,YES,,PHP-3.0.txt,,,,,,,,,,NEW-Fedora,,,,,,,,,,,,,,,,,,,,,,,,,,,,,,,,,,,,,,,,,,,,,,,,,,,,,,,,,,,,,,,,,,,,,,,,,,,,,,,,,,,,,,,,,,,,,,,,,,,,,,,,,,,,,,,,,,,,,,,,,,,,,,,,,,,,,,,,,,,,,,,,,,,,,,,,,,,,,,,,,,,,,,,,,,,,,,,,,,,,,,,,,,,,,,,,,,,,,,,,,,,,,,,,,,,,,,,,,,,,,,,,,,,,,,,,,,,,,,,PHP License v3.01,PHP-3.01,http://www.php.net/license/3_01.txt,"The PHP License v3.01 is essentially the same as v3.0, with the exception of a couple word differences and updated url in section 6.",,,PHP-3.01.txt,,,,,,,,,,NEW-Fedora,,,,,,,,,,,,,,,,,,,,,,,,,,,,,,,,,,,,,,,,,,,,,,,,,,,,,,,,,,,,,,,,,,,,,,,,,,,,,,,,,,,,,,,,,,,,,,,,,,,,,,,,,,,,,,,,,,,,,,,,,,,,,,,,,,,,,,,,,,,,,,,,,,,,,,,,,,,,,,,,,,,,,,,,,,,,,,,,,,,,,,,,,,,,,,,,,,,,,,,,,,,,,,,,,,,,,,,,,,,,,,,,,,,,,,,,,,,,,,,Plexus Classworlds License,Plexus,https://fedoraproject.org/wiki/Licensing/Plexus_Classworlds_License,"This same license is used by several other projects: - Dom4j, e.g. http://dom4j.sourceforge.net/dom4j-1.6.1/license.html- Jaxen, e.g. https://confluence.sakaiproject.org/display/LIC/Jaxen+License+1.3- jCharts, e.g. http://jcharts.sourceforge.net/license.html",,,Plexus.txt,,,,H-YES,,,,,,,,,,,added markup to standard header,added other references/examples for license text,,,,,,,,,,,,,,,,,,,,,,,,,,,,,,,,,,,,,,,,,,,,,,,,,,,,,,,,,,,,,,,,,,,,,,,,,,,,,,,,,,,,,,,,,,,,,,,,,,,,,,,,,,,,,,,,,,,,,,,,,,,,,,,,,,,,,,,,,,,,,,,,,,,,,,,,,,,,,,,,,,,,,,,,,,,,,,,,,,,,,,,,,,,,,,,,,,,,,,,,,,,,,,,,,,,,,,,,,,,,,,,,,,,,,,,,,PostgreSQL License,PostgreSQL,"http://www.postgresql.org/about/licencehttp://www.opensource.org/licenses/PostgreSQL",,YES,,PostgreSQL.txt,,,,,,,,NEW,,,,,,,,,,,,,,,,,,,,,,,,,,,,,,,,,,,,,,,,,,,,,,,,,,,,,,,,,,,,,,,,,,,,,,,,,,,,,,,,,,,,,,,,,,,,,,,,,,,,,,,,,,,,,,,,,,,,,,,,,,,,,,,,,,,,,,,,,,,,,,,,,,,,,,,,,,,,,,,,,,,,,,,,,,,,,,,,,,,,,,,,,,,,,,,,,,,,,,,,,,,,,,,,,,,,,,,,,,,,,,,,,,,,,,,,,,,,,,,,,psfrag License,psfrag,https://fedoraproject.org/wiki/Licensing/psfrag,,,,psfrag.txt,,,,,,,,,,,,,,,,,,,,,,,,,,,,,,,,,,,,,,,,,,,,,,,,,,,,,,,,,,,,,,,,,,,,,,,,,,,,,,,,,,,,,,,,,,,,,,,,,,,,,,,,,,,,,,,,,,,,,,,,,,,,,,,,,,,,,,,,,,,,,,,,,,,,,,,,,,,,,,,,,,,,,,,,,,,,,,,,,,,,,,,,,,,,,,,,,,,,,,,,,,,,,,,,,,,,,,,,,,,,,,,,,,,,,,,,,,,,,,,,,,,,,,,,,psutils License,psutils,https://fedoraproject.org/wiki/Licensing/psutils,,,,psutils.txt,,,,,,,,,,,,,,,,,,,,,,,,,,,,,,,,,,,,,,,,,,,,,,,,,,,,,,,,,,,,,,,,,,,,,,,,,,,,,,,,,,,,,,,,,,,,,,,,,,,,,,,,,,,,,,,,,,,,,,,,,,,,,,,,,,,,,,,,,,,,,,,,,,,,,,,,,,,,,,,,,,,,,,,,,,,,,,,,,,,,,,,,,,,,,,,,,,,,,,,,,,,,,,,,,,,,,,,,,,,,,,,,,,,,,,,,,,,,,,,,,,,,,,,,,Python License 2.0,Python-2.0,http://www.opensource.org/licenses/Python-2.0,overall Python license,YES,,Python-2.0.txt,,,,,,,,,,,,,,,,,,,,,,,,,,,,,,,,,,,,,,,,,,,,,,,,,,,,,,,,,,,,,,,,,,,,,,,,,,,,,,,,,,,,,,,,,,,,,,,,,,,,,,,,,,,,,,,,,,,,,,,,,,,,,,,,,,,,,,,,,,,,,,,,,,,,,,,,,,,,,,,,,,,,,,,,,,,,,,,,,,,,,,,,,,,,,,,,,,,,,,,,,,,,,,,,,,,,,,,,,,,,,,,,,,,,,,,,,,,,,,,,,,,,,,,,,Q Public License 1.0,QPL-1.0,"http://doc.qt.nokia.com/3.3/license.htmlhttp://www.opensource.org/licenses/QPL-1.0",,YES,,QPL-1.0.txt,,,,YES,,,,,,,,NEW (need template for “MD5” v “MD4”),,,,,,,,,,,,,,,,,,,,,,,,,,,,,,,,,,,,,,,,,,,,,,,,,,,,,,,,,,,,,,,,,,,,,,,,,,,,,,,,,,,,,,,,,,,,,,,,,,,,,,,,,,,,,,,,,,,,,,,,,,,,,,,,,,,,,,,,,,,,,,,,,,,,,,,,,,,,,,,,,,,,,,,,,,,,,,,,,,,,,,,,,,,,,,,,,,,,,,,,,,,,,,,,,,,,,,,,,,,,,,,,,,,,,,,,,,,,,Qhull License,Qhull,https://fedoraproject.org/wiki/Licensing/Qhull,,,,Qhull.txt,,,,,,,,,removed?,edited text to include Ruby License only and not the disjunctive choice at the top; added notes as to explanation of Ruby License history,,,,,,,,,,,,,,,,,,,,,,,,,,,,,,,,,,,,,,,,,,,,,,,,,,,,,,,,,,,,,,,,,,,,,,,,,,,,,,,,,,,,,,,,,,,,,,,,,,,,,,,,,,,,,,,,,,,,,,,,,,,,,,,,,,,,,,,,,,,,,,,,,,,,,,,,,,,,,,,,,,,,,,,,,,,,,,,,,,,,,,,,,,,,,,,,,,,,,,,,,,,,,,,,,,,,,,,,,,,,,,,,,,,,,,,,,,,,,,,Rdisc License,Rdisc,https://fedoraproject.org/wiki/Licensing/Rdisc_License,,,,Rdisc.txt,,,,,,,,,,,,,,,,,,,,,,,,,,,,,,,,,,,,,,,,,,,,,,,,,,,,,,,,,,,,,,,,,,,,,,,,,,,,,,,,,,,,,,,,,,,,,,,,,,,,,,,,,,,,,,,,,,,,,,,,,,,,,,,,,,,,,,,,,,,,,,,,,,,,,,,,,,,,,,,,,,,,,,,,,,,,,,,,,,,,,,,,,,,,,,,,,,,,,,,,,,,,,,,,,,,,,,,,,,,,,,,,,,,,,,,,,,,,,,,,,,,,,,,,,RealNetworks Public Source License v1.0,RPSL-1.0,"https://helixcommunity.org/content/rpslhttp://www.opensource.org/licenses/RPSL-1.0",,YES,"Copyright © 1995-2002 RealNetworks, Inc. and/or its licensors. All Rights Reserved.The contents of this file, and the files included with this file, are subject to the current version of the RealNetworks Public Source License Version 1.0 (the ""RPSL"") available at https://www.helixcommunity.org/content/rpsl unless you have licensed the file under the RealNetworks Community Source License Version 1.0 (the ""RCSL"") available at https://www.helixcommunity.org/content/rcsl, in which case the RCSL will apply. You may also obtain the license terms directly from RealNetworks. You may not use this file except in compliance with the RPSL or, if you have a valid RCSL with RealNetworks applicable to this file, the RCSL. Please see the applicable RPSL or RCSL for the rights, obligations and limitations governing use of the contents of the file.This file is part of the Helix DNA Technology. RealNetworks is the developer of the Original code and owns the copyrights in the portions it created.This file, and the files included with this file, is distributed and made available on an 'AS IS' basis, WITHOUT WARRANTY OF ANY KIND, EITHER EXPRESS OR IMPLIED, AND REALNETWORKS HEREBY DISCLAIMS ALL SUCH WARRANTIES, INCLUDING WITHOUT LIMITATION, ANY WARRANTIES OF MERCHANTABILITY, FITNESS FOR A PARTICULAR PURPOSE, QUIET ENJOYMENT OR NON-INFRINGEMENT.Contributor(s): <<var;name=contributor;original=_____;match=.+>>Technology Compatibility Kit Test Suite(s) Location (if licensed under the RCSL):<<var;name=testLocation;original=_____;match=.+>>.",RPSL-1.0.txt,,,,,,,,,,NEW-Fedora,,,,,,,,,,,,,,,,,,,,,,,,,,,,,,,,,,,,,,,,,,,,,,,,,,,,,,,,,,,,,,,,,,,,,,,,,,,,,,,,,,,,,,,,,,,,,,,,,,,,,,,,,,,,,,,,,,,,,,,,,,,,,,,,,,,,,,,,,,,,,,,,,,,,,,,,,,,,,,,,,,,,,,,,,,,,,,,,,,,,,,,,,,,,,,,,,,,,,,,,,,,,,,,,,,,,,,,,,,,,,,,,,,,,,,,,,,,,,,,Reciprocal Public License 1.1,RPL-1.1,http://opensource.org/licenses/RPL-1.1,"This license has been superseded by the Reciprocal Public License, version 1.5",YES,"Copyright (C) 1999-2002 Technical Pursuit Inc., All Rights Reserved. Patent Pending, Technical Pursuit Inc.    Unless explicitly acquired and licensed from Licensor under the Technical Pursuit License (""TPL"") Version 1.0 or greater, the contents of this file are subject to the Reciprocal Public License (""RPL"") Version 1.1, or subsequent versions as allowed by the RPL, and You may not copy or use this file in either source code or executable form, except in compliance with the terms and conditions of the RPL.    You may obtain a copy of both the TPL and the RPL (the ""Licenses"") from Technical Pursuit Inc. at http://www.technicalpursuit.com.    All software distributed under the Licenses is provided strictly on an ""AS IS"" basis, WITHOUT WARRANTY OF ANY KIND, EITHER EXPRESS OR IMPLIED, AND TECHNICAL PURSUIT INC. HEREBY DISCLAIMS ALL SUCH WARRANTIES, INCLUDING WITHOUT LIMITATION, ANY WARRANTIES OF MERCHANTABILITY, FITNESS FOR A PARTICULAR PURPOSE, QUIET ENJOYMENT, OR NON-INFRINGEMENT. See the Licenses for specific language governing rights and limitations under the Licenses.",RPL-1.1.txt,,,,,,,,,,NEW-Fedora,,,,,,,,,,,,,,,,,,,,,,,,,,,,,,,,,,,,,,,,,,,,,,,,,,,,,,,,,,,,,,,,,,,,,,,,,,,,,,,,,,,,,,,,,,,,,,,,,,,,,,,,,,,,,,,,,,,,,,,,,,,,,,,,,,,,,,,,,,,,,,,,,,,,,,,,,,,,,,,,,,,,,,,,,,,,,,,,,,,,,,,,,,,,,,,,,,,,,,,,,,,,,,,,,,,,,,,,,,,,,,,,,,,,,,,,,,,,,,,Reciprocal Public License 1.5,RPL-1.5,http://www.opensource.org/licenses/RPL-1.5,This license was released: 15 July 2007,YES,"Unless explicitly acquired and licensed from Licensor under another license, the contents of this file are subject to the Reciprocal Public License (""RPL"") Version 1.5, or subsequent versions as allowed by the RPL, and You may not copy or use this file in either source code or executable form, except in compliance with the terms and conditions of the RPL.All software distributed under the RPL is provided strictly on an ""AS IS"" basis, WITHOUT WARRANTY OF ANY KIND, EITHER EXPRESS OR IMPLIED, AND LICENSOR HEREBY DISCLAIMS ALL SUCH WARRANTIES, INCLUDING WITHOUT LIMITATION, ANY WARRANTIES OF MERCHANTABILITY, FITNESS FOR A PARTICULAR PURPOSE, QUIET ENJOYMENT, OR NON-INFRINGEMENT. See the RPL for specific language governing rights and limitations under the RPL.",RPL-1.5.txt,,,,,,,,,,NEW-Fedora,,,,,,,,,,,,,,,,,,,,,,,,,,,,,,,,,,,,,,,,,,,,,,,,,,,,,,,,,,,,,,,,,,,,,,,,,,,,,,,,,,,,,,,,,,,,,,,,,,,,,,,,,,,,,,,,,,,,,,,,,,,,,,,,,,,,,,,,,,,,,,,,,,,,,,,,,,,,,,,,,,,,,,,,,,,,,,,,,,,,,,,,,,,,,,,,,,,,,,,,,,,,,,,,,,,,,,,,,,,,,,,,,,,,,,,,,,,,,,,Red Hat eCos Public License v1.1,RHeCos-1.1,http://ecos.sourceware.org/old-license.html,,,,RHeCos-1.1.txt,,,,,,,,,,,,,,NEW,,,,,,,,,,,,,,,,,,,,,,,,,,,,,,,,,,,,,,,,,,,,,,,,,,,,,,,,,,,,,,,,,,,,,,,,,,,,,,,,,,,,,,,,,,,,,,,,,,,,,,,,,,,,,,,,,,,,,,,,,,,,,,,,,,,,,,,,,,,,,,,,,,,,,,,,,,,,,,,,,,,,,,,,,,,,,,,,,,,,,,,,,,,,,,,,,,,,,,,,,,,,,,,,,,,,,,,,,,,,,,,,,,,,,,,,,,,Ricoh Source Code Public License,RSCPL,http://www.opensource.org/licenses/RSCPL,,YES,"The contents of this file are subject to the Ricoh Source Code Public License Version 1.0 (the ""License""); you may not use this file except in compliance with the License. You may obtain a copy of the License at http://www.risource.org/RPLSoftware distributed under the License is distributed on an ""AS IS"" basis, WITHOUT WARRANTY OF ANY KIND, either express or implied. See the License for the specific language governing rights and limitations under the License.This code was initially developed by Ricoh Silicon Valley, Inc. Portions created by Ricoh Silicon Valley, Inc. are Copyright (C) 1995-1999. All Rights Reserved.Contributor(s): {{---}}.",RSCPL.txt,,,,,,,NEW,,,,,,,,,,,,,,,,,,,,,,,,,,,,,,,,,,,,,,,,,,,,,,,,,,,,,,,,,,,,,,,,,,,,,,,,,,,,,,,,,,,,,,,,,,,,,,,,,,,,,,,,,,,,,,,,,,,,,,,,,,,,,,,,,,,,,,,,,,,,,,,,,,,,,,,,,,,,,,,,,,,,,,,,,,,,,,,,,,,,,,,,,,,,,,,,,,,,,,,,,,,,,,,,,,,,,,,,,,,,,,,,,,,,,,,,,,,,,,,,,,RSA Message-Digest License ,RSA-MD,http://www.faqs.org/rfcs/rfc1321.html,,,,RSA-MD.txt,,,,,,,NEW,,,,,,,,,,,,,,,,,,,,,,,,,,,,,,,,,,,,,,,,,,,,,,,,,,,,,,,,,,,,,,,,,,,,,,,,,,,,,,,,,,,,,,,,,,,,,,,,,,,,,,,,,,,,,,,,,,,,,,,,,,,,,,,,,,,,,,,,,,,,,,,,,,,,,,,,,,,,,,,,,,,,,,,,,,,,,,,,,,,,,,,,,,,,,,,,,,,,,,,,,,,,,,,,,,,,,,,,,,,,,,,,,,,,,,,,,,,,,,,,,,Ruby License,Ruby,http://www.ruby-lang.org/en/LICENSE.txt,"Ruby is disjunctively licensed project that allows the choice of this license and another.  The other license choice has changed over time (from GPL originally, to BSD-2-Clause currently), so one needs to be aware of that change.  The Ruby License itself is un-versioned, but has varied a bit over the years, the last substantive variation being in 2002.",,,Ruby.txt,,,,,,,NEW,,,,,,,,,,,,,,,,,,,,,,,,,,,,,,,,,,,,,,,,,,,,,,,,,,,,,,,,,,,,,,,,,,,,,,,,,,,,,,,,,,,,,,,,,,,,,,,,,,,,,,,,,,,,,,,,,,,,,,,,,,,,,,,,,,,,,,,,,,,,,,,,,,,,,,,,,,,,,,,,,,,,,,,,,,,,,,,,,,,,,,,,,,,,,,,,,,,,,,,,,,,,,,,,,,,,,,,,,,,,,,,,,,,,,,,,,,,,,,,,,,Sax Public Domain Notice,SAX-PD,http://www.saxproject.org/copying.html,,,,SAX-PD.txt,,,,,,,,,,,,,,,,,,,,,,,,,,,,,,,,,,,,,,,,,,,,,,,,,,,,,,,,,,,,,,,,,,,,,,,,,,,,,,,,,,,,,,,,,,,,,,,,,,,,,,,,,,,,,,,,,,,,,,,,,,,,,,,,,,,,,,,,,,,,,,,,,,,,,,,,,,,,,,,,,,,,,,,,,,,,,,,,,,,,,,,,,,,,,,,,,,,,,,,,,,,,,,,,,,,,,,,,,,,,,,,,,,,,,,,,,,,,,,,,,,,,,,,,,Saxpath License,Saxpath,https://fedoraproject.org/wiki/Licensing/Saxpath_License,,,,Saxpath.txt,,,,,,,,,,,,,,,,,,,,,,,,,,,,,,,,,,,,,,,,,,,,,,,,,,,,,,,,,,,,,,,,,,,,,,,,,,,,,,,,,,,,,,,,,,,,,,,,,,,,,,,,,,,,,,,,,,,,,,,,,,,,,,,,,,,,,,,,,,,,,,,,,,,,,,,,,,,,,,,,,,,,,,,,,,,,,,,,,,,,,,,,,,,,,,,,,,,,,,,,,,,,,,,,,,,,,,,,,,,,,,,,,,,,,,,,,,,,,,,,,,,,,,,,,SCEA Shared Source License,SCEA,http://research.scea.com/scea_shared_source_license.html,,,,SCEA.txt,,,,,,OSI issue resolved (OSI website),,,,,,,,,,,,,,,,,,,,,,,,,,,,,,,,,,,,,,,,,,,,,,,,,,,,,,,,,,,,,,,,,,,,,,,,,,,,,,,,,,,,,,,,,,,,,,,,,,,,,,,,,,,,,,,,,,,,,,,,,,,,,,,,,,,,,,,,,,,,,,,,,,,,,,,,,,,,,,,,,,,,,,,,,,,,,,,,,,,,,,,,,,,,,,,,,,,,,,,,,,,,,,,,,,,,,,,,,,,,,,,,,,,,,,,,,,,,,,,,,,,Scheme Widget Library (SWL) Software License Agreement,SWL,https://fedoraproject.org/wiki/Licensing/SWL,,,,SWL.txt,,,,,,,,,,,,,,,,,,,,,,,,,,,,,,,,,,,,,,,,,,,,,,,,,,,,,,,,,,,,,,,,,,,,,,,,,,,,,,,,,,,,,,,,,,,,,,,,,,,,,,,,,,,,,,,,,,,,,,,,,,,,,,,,,,,,,,,,,,,,,,,,,,,,,,,,,,,,,,,,,,,,,,,,,,,,,,,,,,,,,,,,,,,,,,,,,,,,,,,,,,,,,,,,,,,,,,,,,,,,,,,,,,,,,,,,,,,,,,,,,,,,,,,,,Secure Messaging Protocol Public License,SMPPL,https://github.com/dcblake/SMP/blob/master/Documentation/License.txt,,,,SMPPL.txt,,,,,,,,,,NEW-Fedora,,,,,,,,,,,,,,,,,,,,,,,,,,,,,,,,,,,,,,,,,,,,,,,,,,,,,,,,,,,,,,,,,,,,,,,,,,,,,,,,,,,,,,,,,,,,,,,,,,,,,,,,,,,,,,,,,,,,,,,,,,,,,,,,,,,,,,,,,,,,,,,,,,,,,,,,,,,,,,,,,,,,,,,,,,,,,,,,,,,,,,,,,,,,,,,,,,,,,,,,,,,,,,,,,,,,,,,,,,,,,,,,,,,,,,,,,,,,,,,Sendmail License,Sendmail,http://www.sendmail.com/pdfs/open_source/sendmail_license.pdf,,,,Sendmail.txt,,,,,,,,,,,,,NEW,,,,,,,,,,,,,,,,,,,,,,,,,,,,,,,,,,,,,,,,,,,,,,,,,,,,,,,,,,,,,,,,,,,,,,,,,,,,,,,,,,,,,,,,,,,,,,,,,,,,,,,,,,,,,,,,,,,,,,,,,,,,,,,,,,,,,,,,,,,,,,,,,,,,,,,,,,,,,,,,,,,,,,,,,,,,,,,,,,,,,,,,,,,,,,,,,,,,,,,,,,,,,,,,,,,,,,,,,,,,,,,,,,,,,,,,,,,,SGI Free Software License B v1.0,SGI-B-1.0,http://oss.sgi.com/projects/FreeB/SGIFreeSWLicB.1.0.html,This license was released 25 January 2000,,"License Applicability. Except to the extent portions of this file are made subject to an alternative license as permitted in the SGI Free Software License B, Version 1.0 (the ""License""), the contents of this file are subject only to the provisions of the License. You may not use this file except in compliance with the License. You may obtain a copy of the License at Silicon Graphics, Inc., attn: Legal Services, 1600 Ampitheatre Parkway, Mountain View, CA 94043-1351, or at:http://oss.sgi.com/projects/FreeBNote that, as provided in the License, the Software is distributed on an ""AS IS"" basis, with ALL EXPRESS AND IMPLIED WARRANTIES AND CONDITIONS DISCLAIMED, INCLUDING, WITHOUT LIMITATION, ANY IMPLIED WARRANTIES AND CONDITIONS OF MERCHANTABILITY, SATISFACTORY QUALITY, FITNESS FOR A PARTICULAR PURPOSE, AND NON-INFRINGEMENT.Original Code. The Original Code is: [name of software, version number, and release date], developed by Silicon Graphics, Inc. The Original Code is Copyright (c) [dates of first publication, as appearing in the Notice in the Original Code] Silicon Graphics, Inc. Copyright in any portions created by third parties is as indicated elsewhere herein. All Rights Reserved.",SGI-B-1.0.txt,,,,,,,,,,,,,NEW,,,,,,,,,,,,,,,,,,,,,,,,,,,,,,,,,,,,,,,,,,,,,,,,,,,,,,,,,,,,,,,,,,,,,,,,,,,,,,,,,,,,,,,,,,,,,,,,,,,,,,,,,,,,,,,,,,,,,,,,,,,,,,,,,,,,,,,,,,,,,,,,,,,,,,,,,,,,,,,,,,,,,,,,,,,,,,,,,,,,,,,,,,,,,,,,,,,,,,,,,,,,,,,,,,,,,,,,,,,,,,,,,,,,,,,,,,,,