Creative Commons Attribution Share Alike 1.0,CC-BY-SA-1.0,http://creativecommons.org/licenses/by-sa/1.0/legalcode,,,,CC-BY-SA-1.0.txt,,,,YES,,,,,,,,,,,,,,,,,,,,,,,,,,,,,,,,,,,,,,,,,,,,,,,,,,,,,,,,,,,,,,,,,,,,,,,,,,,,,,,,,,,,,,,,,,,,,,,,,,,,,,,,,,,,,,,,,,,,,,,,,,,,,,,,,,,,,,,,,,,,,,,,,,,,,,,,,,,,,,,,,,,,,,,,,,,,,,,,,,,,,,,,,,,,,,,,,,,,,,,,,,,,,,,,,,,,,,,,,,,,,,,,,,,,,,,,,,,,,,,,,,,,,Creative Commons Attribution Share Alike 2.0,CC-BY-SA-2.0,http://creativecommons.org/licenses/by-sa/2.0/legalcode,,,,CC-BY-SA-2.0.txt,,,,YES,,,,,,,,,,,,,,,,,,,,,,,,,,,,,,,,,,,,,,,,,,,,,,,,,,,,,,,,,,,,,,,,,,,,,,,,,,,,,,,,,,,,,,,,,,,,,,,,,,,,,,,,,,,,,,,,,,,,,,,,,,,,,,,,,,,,,,,,,,,,,,,,,,,,,,,,,,,,,,,,,,,,,,,,,,,,,,,,,,,,,,,,,,,,,,,,,,,,,,,,,,,,,,,,,,,,,,,,,,,,,,,,,,,,,,,,,,,,,,,,,,,,,Creative Commons Attribution Share Alike 2.5,CC-BY-SA-2.5,http://creativecommons.org/licenses/by-sa/2.5/legalcode,,,,CC-BY-SA-2.5.txt,,,,YES,,,,,,,,,,,,,,,,,,,,,,,,,,,,,,,,,,,,,,,,,,,,,,,,,,,,,,,,,,,,,,,,,,,,,,,,,,,,,,,,,,,,,,,,,,,,,,,,,,,,,,,,,,,,,,,,,,,,,,,,,,,,,,,,,,,,,,,,,,,,,,,,,,,,,,,,,,,,,,,,,,,,,,,,,,,,,,,,,,,,,,,,,,,,,,,,,,,,,,,,,,,,,,,,,,,,,,,,,,,,,,,,,,,,,,,,,,,,,,,,,,,,,Creative Commons Attribution Share Alike 3.0,CC-BY-SA-3.0,http://creativecommons.org/licenses/by-sa/3.0/legalcode,,,,CC-BY-SA-3.0.txt,,,,YES,,,,,,,,,,,,,,,,,,,,,,,,,,,,,,,,,,,,,,,,,,,,,,,,,,,,,,,,,,,,,,,,,,,,,,,,,,,,,,,,,,,,,,,,,,,,,,,,,,,,,,,,,,,,,,,,,,,,,,,,,,,,,,,,,,,,,,,,,,,,,,,,,,,,,,,,,,,,,,,,,,,,,,,,,,,,,,,,,,,,,,,,,,,,,,,,,,,,,,,,,,,,,,,,,,,,,,,,,,,,,,,,,,,,,,,,,,,,,,,,,,,,,Creative Commons Attribution Share Alike 4.0,CC-BY-SA-4.0,http://creativecommons.org/licenses/by-sa/4.0/legalcode,,,,CC-BY-SA-4.0.txt,,,,YES,,,,,,NEW,,,,,,,,,,,,,,,,,,,,,,,,,,,,,,,,,,,,,,,,,,,,,,,,,,,,,,,,,,,,,,,,,,,,,,,,,,,,,,,,,,,,,,,,,,,,,,,,,,,,,,,,,,,,,,,,,,,,,,,,,,,,,,,,,,,,,,,,,,,,,,,,,,,,,,,,,,,,,,,,,,,,,,,,,,,,,,,,,,,,,,,,,,,,,,,,,,,,,,,,,,,,,,,,,,,,,,,,,,,,,,,,,,,,,,,,,,,,,,,Creative Commons Zero v1.0 Universal,CC0-1.0,http://creativecommons.org/publicdomain/zero/1.0/legalcode,,,,CC0-1.0.txt,,,,YES,,,,,,,,,,,,,,,,,,,,,,,,,,,,,,,,,,,,,,,,,,,,,,,,,,,,,,,,,,,,,,,,,,,,,,,,,,,,,,,,,,,,,,,,,,,,,,,,,,,,,,,,,,,,,,,,,,,,,,,,,,,,,,,,,,,,,,,,,,,,,,,,,,,,,,,,,,,,,,,,,,,,,,,,,,,,,,,,,,,,,,,,,,,,,,,,,,,,,,,,,,,,,,,,,,,,,,,,,,,,,,,,,,,,,,,,,,,,,,,,,,,,,Crossword License,Crossword,https://fedoraproject.org/wiki/Licensing/Crossword,,,,Crossword.txt,,,,,,,,,,NEW-Fedora,,,,,,,,,,,,,,,,,,,,,,,,,,,,,,,,,,,,,,,,,,,,,,,,,,,,,,,,,,,,,,,,,,,,,,,,,,,,,,,,,,,,,,,,,,,,,,,,,,,,,,,,,,,,,,,,,,,,,,,,,,,,,,,,,,,,,,,,,,,,,,,,,,,,,,,,,,,,,,,,,,,,,,,,,,,,,,,,,,,,,,,,,,,,,,,,,,,,,,,,,,,,,,,,,,,,,,,,,,,,,,,,,,,,,,,,,,,,,,,CrystalStacker License,CrystalStacker,https://fedoraproject.org/wiki/Licensing:CrystalStacker?rd=Licensing/CrystalStacker,,,,CrystalStacker.txt,,,,,,,,,,,,,,NEW,,,,,,,,,,,,,,,,,,,,,,,,,,,,,,,,,,,,,,,,,,,,,,,,,,,,,,,,,,,,,,,,,,,,,,,,,,,,,,,,,,,,,,,,,,,,,,,,,,,,,,,,,,,,,,,,,,,,,,,,,,,,,,,,,,,,,,,,,,,,,,,,,,,,,,,,,,,,,,,,,,,,,,,,,,,,,,,,,,,,,,,,,,,,,,,,,,,,,,,,,,,,,,,,,,,,,,,,,,,,,,,,,,,,,,,,,,,CUA Office Public License v1.0,CUA-OPL-1.0,http://opensource.org/licenses/CUA-OPL-1.0,,YES,"The contents of this file are subject to the CUA Office Public License Version 1.0 (the ""License""); you may not use this file except in compliance with the License. You may obtain a copy of the License at http://cuaoffice.sourceforge.net/Software distributed under the License is distributed on an ""AS IS"" basis, WITHOUT WARRANTY OF ANY KIND, either express or implied. See the License for the specific language governing rights and limitations under the License.The Original Code is <<var;name=code;original=_____;match=.+>>.The Initial Developer of the Original Code is  <<var;name=developer;original=_____;match=.+>>.Portions created by  <<var;name=createdby;original=_____;match=.+>> are Copyright (C)  <<var;name=copyright;original=_____;match=.+>>. All Rights Reserved.Contributor(s): <<var;name=contributor;original=_____;match=.+>>.Alternatively, the contents of this file may be used under the terms of the <<var;name=AltLicense;original=_____;match=.+>> license (the "" <<var;name=licenseName;original=[____];match=.+>> License""), in which case the provisions of  <<var;name=licenseName;original=[____];match=.+>> License are applicable instead of those above. If you wish to allow use of your version of this file only under the terms of the  <<var;name=licenseName;original=[____];match=.+>> License and not to allow others to use your version of this file under the CUAPL, indicate your decision by deleting the provisions above and replace them with the notice and other provisions required by the <<var;name=licenseName;original=[____];match=.+>> License. If you do not delete the provisions above, a recipient may use your version of this file under either the CUAPL or the <<var;name=licenseName;original=[____];match=.+>> License.""",CUA-OPL-1.0.txt,,,,H-YES,,,,OSI url updated,,,,,,,added markup to standard header,,,,,,,,,,,,,,,,,,,,,,,,,,,,,,,,,,,,,,,,,,,,,,,,,,,,,,,,,,,,,,,,,,,,,,,,,,,,,,,,,,,,,,,,,,,,,,,,,,,,,,,,,,,,,,,,,,,,,,,,,,,,,,,,,,,,,,,,,,,,,,,,,,,,,,,,,,,,,,,,,,,,,,,,,,,,,,,,,,,,,,,,,,,,,,,,,,,,,,,,,,,,,,,,,,,,,,,,,,,,,,,,,,,,,,,,,,Cube License,Cube,https://fedoraproject.org/wiki/Licensing/Cube,,,,Cube.txt,,,,,,,,,,NEW-Fedora,,,,,,,,,,,,,,,,,,,,,,,,,,,,,,,,,,,,,,,,,,,,,,,,,,,,,,,,,,,,,,,,,,,,,,,,,,,,,,,,,,,,,,,,,,,,,,,,,,,,,,,,,,,,,,,,,,,,,,,,,,,,,,,,,,,,,,,,,,,,,,,,,,,,,,,,,,,,,,,,,,,,,,,,,,,,,,,,,,,,,,,,,,,,,,,,,,,,,,,,,,,,,,,,,,,,,,,,,,,,,,,,,,,,,,,,,,,,,,,curl License,curl,https://github.com/bagder/curl/blob/master/COPYING,,,,curl.txt,,,,,,,,,,,,,,,NEW,,,,,,,,,,,,,,,,,,,,,,,,,,,,,,,,,,,,,,,,,,,,,,,,,,,,,,,,,,,,,,,,,,,,,,,,,,,,,,,,,,,,,,,,,,,,,,,,,,,,,,,,,,,,,,,,,,,,,,,,,,,,,,,,,,,,,,,,,,,,,,,,,,,,,,,,,,,,,,,,,,,,,,,,,,,,,,,,,,,,,,,,,,,,,,,,,,,,,,,,,,,,,,,,,,,,,,,,,,,,,,,,,,,,,,,,,,Deutsche Freie Software Lizenz,D-FSL-1.0,"http://www.dipp.nrw.de/d-fsl/lizenzen/http://www.dipp.nrw.de/d-fsl/index_html/lizenzen/de/D-FSL-1_0_de.txt",This license was created for and is backed by the German state.  The English translation can be found here: http://www.dipp.nrw.de/d-fsl/index_html/lizenzen/en/D-FSL-1_0_en.txt,,"Copyright (C) 20[jj] [Name des Rechtsinhabers]. Dieses Programm kann durch jedermann gemäß den Bestimmungen der Deutschen Freien Software Lizenz genutzt werden. Die Lizenz kann unter <http://www.d-fsl.de> abgerufen werden.",D-FSL-1.0.txt,,,,,,,,NEW,,,,,,,updated standard header,,,,,,,,,,,,,,,,,,,,,,,,,,,,,,,,,,,,,,,,,,,,,,,,,,,,,,,,,,,,,,,,,,,,,,,,,,,,,,,,,,,,,,,,,,,,,,,,,,,,,,,,,,,,,,,,,,,,,,,,,,,,,,,,,,,,,,,,,,,,,,,,,,,,,,,,,,,,,,,,,,,,,,,,,,,,,,,,,,,,,,,,,,,,,,,,,,,,,,,,,,,,,,,,,,,,,,,,,,,,,,,,,,,,,,,,,,diffmark license,diffmark,https://fedoraproject.org/wiki/Licensing/diffmark,,,,diffmark.txt,,,,,,,,,,NEW-Fedora,,,,,,,,,,,,,,,,,,,,,,,,,,,,,,,,,,,,,,,,,,,,,,,,,,,,,,,,,,,,,,,,,,,,,,,,,,,,,,,,,,,,,,,,,,,,,,,,,,,,,,,,,,,,,,,,,,,,,,,,,,,,,,,,,,,,,,,,,,,,,,,,,,,,,,,,,,,,,,,,,,,,,,,,,,,,,,,,,,,,,,,,,,,,,,,,,,,,,,,,,,,,,,,,,,,,,,,,,,,,,,,,,,,,,,,,,,,,,,,Do What The F*ck You Want To Public License,WTFPL,http://sam.zoy.org/wtfpl/COPYING,,,,WTFPL.txt,,,,,,,NEW,,,,,,,,,,,,,,,,,,,,,,,,,,,,,,,,,,,,,,,,,,,,,,,,,,,,,,,,,,,,,,,,,,,,,,,,,,,,,,,,,,,,,,,,,,,,,,,,,,,,,,,,,,,,,,,,,,,,,,,,,,,,,,,,,,,,,,,,,,,,,,,,,,,,,,,,,,,,,,,,,,,,,,,,,,,,,,,,,,,,,,,,,,,,,,,,,,,,,,,,,,,,,,,,,,,,,,,,,,,,,,,,,,,,,,,,,,,,,,,,,,DOC License,DOC,http://www.cs.wustl.edu/~schmidt/ACE-copying.html,,,,DOC.txt,,,,,,,,,,NEW-Fedora,,,,,,,,,,,,,,,,,,,,,,,,,,,,,,,,,,,,,,,,,,,,,,,,,,,,,,,,,,,,,,,,,,,,,,,,,,,,,,,,,,,,,,,,,,,,,,,,,,,,,,,,,,,,,,,,,,,,,,,,,,,,,,,,,,,,,,,,,,,,,,,,,,,,,,,,,,,,,,,,,,,,,,,,,,,,,,,,,,,,,,,,,,,,,,,,,,,,,,,,,,,,,,,,,,,,,,,,,,,,,,,,,,,,,,,,,,,,,,,Dotseqn License,Dotseqn,https://fedoraproject.org/wiki/Licensing/Dotseqn,,,,Dotseqn.txt,,,,,,,,,,NEW-Fedora,,,,,,,,,,,,,,,,,,,,,,,,,,,,,,,,,,,,,,,,,,,,,,,,,,,,,,,,,,,,,,,,,,,,,,,,,,,,,,,,,,,,,,,,,,,,,,,,,,,,,,,,,,,,,,,,,,,,,,,,,,,,,,,,,,,,,,,,,,,,,,,,,,,,,,,,,,,,,,,,,,,,,,,,,,,,,,,,,,,,,,,,,,,,,,,,,,,,,,,,,,,,,,,,,,,,,,,,,,,,,,,,,,,,,,,,,,,,,,,DSDP License,DSDP,https://fedoraproject.org/wiki/Licensing/DSDP,,,,DSDP.txt,,,,,,,,,,NEW-Fedora,,,,,,,,,,,,,,,,,,,,,,,,,,,,,,,,,,,,,,,,,,,,,,,,,,,,,,,,,,,,,,,,,,,,,,,,,,,,,,,,,,,,,,,,,,,,,,,,,,,,,,,,,,,,,,,,,,,,,,,,,,,,,,,,,,,,,,,,,,,,,,,,,,,,,,,,,,,,,,,,,,,,,,,,,,,,,,,,,,,,,,,,,,,,,,,,,,,,,,,,,,,,,,,,,,,,,,,,,,,,,,,,,,,,,,,,,,,,,,,dvipdfm License,dvipdfm,https://fedoraproject.org/wiki/Licensing/dvipdfm,,,,dvipdfm.txt,,,,,,,,,,NEW-Fedora,,,,,,,,,,,,,,,,,,,,,,,,,,,,,,,,,,,,,,,,,,,,,,,,,,,,,,,,,,,,,,,,,,,,,,,,,,,,,,,,,,,,,,,,,,,,,,,,,,,,,,,,,,,,,,,,,,,,,,,,,,,,,,,,,,,,,,,,,,,,,,,,,,,,,,,,,,,,,,,,,,,,,,,,,,,,,,,,,,,,,,,,,,,,,,,,,,,,,,,,,,,,,,,,,,,,,,,,,,,,,,,,,,,,,,,,,,,,,,,Eclipse Public License 1.0,EPL-1.0,"http://www.eclipse.org/legal/epl-v10.htmlhttp://www.opensource.org/licenses/EPL-1.0",EPL replaced the CPL on 28 June 2005.,YES,,EPL-1.0.txt,,,,,,,,,,,,,,,,,,,,,,,,,,,,,,,,,,,,,,,,,,,,,,,,,,,,,,,,,,,,,,,,,,,,,,,,,,,,,,,,,,,,,,,,,,,,,,,,,,,,,,,,,,,,,,,,,,,,,,,,,,,,,,,,,,,,,,,,,,,,,,,,,,,,,,,,,,,,,,,,,,,,,,,,,,,,,,,,,,,,,,,,,,,,,,,,,,,,,,,,,,,,,,,,,,,,,,,,,,,,,,,,,,,,,,,,,,,,,,,,,,,,,,,,,Educational Community License v1.0,ECL-1.0,http://opensource.org/licenses/ECL-1.0,,YES,"Copyright (c) <<var;name=copyright;original=<year> <copyright holders>;match=.+>>Licensed under the Educational Community License version 1.0",ECL-1.0.txt,,,,"YESH-YES",,standard header added (carrots changed to square brackets in standard header),,OSI url updated,,,,,,,added markup to standard header,,,,,,,,,,,,,,,,,,,,,,,,,,,,,,,,,,,,,,,,,,,,,,,,,,,,,,,,,,,,,,,,,,,,,,,,,,,,,,,,,,,,,,,,,,,,,,,,,,,,,,,,,,,,,,,,,,,,,,,,,,,,,,,,,,,,,,,,,,,,,,,,,,,,,,,,,,,,,,,,,,,,,,,,,,,,,,,,,,,,,,,,,,,,,,,,,,,,,,,,,,,,,,,,,,,,,,,,,,,,,,,,,,,,,,,,,,Educational Community License v2.0,ECL-2.0,http://opensource.org/licenses/ECL-2.0,"The Educational Community License version 2.0 (""ECL"") consists of the Apache 2.0 license, modified to change the scope of the patent grant in section 3 to be specific to the needs of the education communities using this license.The url included in the boilerplate notice does not work. (15/10/10)",YES,"Copyright <<var;name=copyright;original=[yyyy] [copyright owner];match=.+>>Licensed under the Educational Community License, Version 2.0 (the ""License""); you may not use this file except in compliance with the License. You may obtain a copy of the License at  http://www.osedu.org/licenses/ECL-2.0Unless required by applicable law or agreed to in writing, software distributed under the License is distributed on an ""AS IS"" BASIS, WITHOUT WARRANTIES OR CONDITIONS OF ANY KIND, either express or implied. See the License for the specific language governing permissions and limitations under the License.",ECL-2.0.txt,,,,H-YES,,"link at top of license is broken; should we note this?  Should this info before ""terms and conditions"" even be included as part of license text?",do not add these notes (see 9/19/12 meeting minutes for discussion),OSI url updated,,,,,,,added markup to standard header,,,,,,,,,,,,,,,,,,,,,,,,,,,,,,,,,,,,,,,,,,,,,,,,,,,,,,,,,,,,,,,,,,,,,,,,,,,,,,,,,,,,,,,,,,,,,,,,,,,,,,,,,,,,,,,,,,,,,,,,,,,,,,,,,,,,,,,,,,,,,,,,,,,,,,,,,,,,,,,,,,,,,,,,,,,,,,,,,,,,,,,,,,,,,,,,,,,,,,,,,,,,,,,,,,,,,,,,,,,,,,,,,,,,,,,,,,eGenix.com Public License 1.1.0,eGenix,"http://www.egenix.com/products/eGenix.com-Public-License-1.1.0.pdfhttps://fedoraproject.org/wiki/Licensing/eGenix.com_Public_License_1.1.0",,,,eGenix.txt,,,,,,,,,,NEW-Fedora,,,,,,,,,,,,,,,,,,,,,,,,,,,,,,,,,,,,,,,,,,,,,,,,,,,,,,,,,,,,,,,,,,,,,,,,,,,,,,,,,,,,,,,,,,,,,,,,,,,,,,,,,,,,,,,,,,,,,,,,,,,,,,,,,,,,,,,,,,,,,,,,,,,,,,,,,,,,,,,,,,,,,,,,,,,,,,,,,,,,,,,,,,,,,,,,,,,,,,,,,,,,,,,,,,,,,,,,,,,,,,,,,,,,,,,,,,,,,,,Eiffel Forum License v1.0,EFL-1.0,"http://www.eiffel-nice.org/license/forum.txthttp://opensource.org/licenses/EFL-1.0",This license has been superseded by v2.0,YES,,EFL-1.0.txt,,,,,may need to update OSI link later,,,OSI url updated,,,,,,,,,,,,,,,,,,,,,,,,,,,,,,,,,,,,,,,,,,,,,,,,,,,,,,,,,,,,,,,,,,,,,,,,,,,,,,,,,,,,,,,,,,,,,,,,,,,,,,,,,,,,,,,,,,,,,,,,,,,,,,,,,,,,,,,,,,,,,,,,,,,,,,,,,,,,,,,,,,,,,,,,,,,,,,,,,,,,,,,,,,,,,,,,,,,,,,,,,,,,,,,,,,,,,,,,,,,,,,,,,,,,,,,,,,,,,,,,,Eiffel Forum License v2.0,EFL-2.0,"http://www.eiffel-nice.org/license/eiffel-forum-license-2.htmlhttp://opensource.org/licenses/EFL-2.0",,YES,,EFL-2.0.txt,,,,,,,,OSI url updated,,,,,,,,,,,,,,,,,,,,,,,,,,,,,,,,,,,,,,,,,,,,,,,,,,,,,,,,,,,,,,,,,,,,,,,,,,,,,,,,,,,,,,,,,,,,,,,,,,,,,,,,,,,,,,,,,,,,,,,,,,,,,,,,,,,,,,,,,,,,,,,,,,,,,,,,,,,,,,,,,,,,,,,,,,,,,,,,,,,,,,,,,,,,,,,,,,,,,,,,,,,,,,,,,,,,,,,,,,,,,,,,,,,,,,,,,,,,,,,,,Enlightenment License (e16),MIT-advertising,https://fedoraproject.org/wiki/Licensing/MIT_With_Advertising,"This license is a modified version of the common MIT license, with an additional advertising clause",,,MIT-advertising.txt,,,,,,,,,,NEW-Fedora,,,,,,,,,,,,,,,,,,,,,,,,,,,,,,,,,,,,,,,,,,,,,,,,,,,,,,,,,,,,,,,,,,,,,,,,,,,,,,,,,,,,,,,,,,,,,,,,,,,,,,,,,,,,,,,,,,,,,,,,,,,,,,,,,,,,,,,,,,,,,,,,,,,,,,,,,,,,,,,,,,,,,,,,,,,,,,,,,,,,,,,,,,,,,,,,,,,,,,,,,,,,,,,,,,,,,,,,,,,,,,,,,,,,,,,,,,,,,,,enna License,MIT-enna,https://fedoraproject.org/wiki/Licensing/MIT#enna,,,,MIT-enna.txt,,,,,,,,,,NEW-Fedora,,,,,,,,,,,,,,,,,,,,,,,,,,,,,,,,,,,,,,,,,,,,,,,,,,,,,,,,,,,,,,,,,,,,,,,,,,,,,,,,,,,,,,,,,,,,,,,,,,,,,,,,,,,,,,,,,,,,,,,,,,,,,,,,,,,,,,,,,,,,,,,,,,,,,,,,,,,,,,,,,,,,,,,,,,,,,,,,,,,,,,,,,,,,,,,,,,,,,,,,,,,,,,,,,,,,,,,,,,,,,,,,,,,,,,,,,,,,,,,Entessa Public License v1.0,Entessa,http://opensource.org/licenses/Entessa,,YES,,Entessa.txt,,,,,,,,OSI url updated,,,,,,,,,,,,,,,,,,,,,,,,,,,,,,,,,,,,,,,,,,,,,,,,,,,,,,,,,,,,,,,,,,,,,,,,,,,,,,,,,,,,,,,,,,,,,,,,,,,,,,,,,,,,,,,,,,,,,,,,,,,,,,,,,,,,,,,,,,,,,,,,,,,,,,,,,,,,,,,,,,,,,,,,,,,,,,,,,,,,,,,,,,,,,,,,,,,,,,,,,,,,,,,,,,,,,,,,,,,,,,,,,,,,,,,,,,,,,,,,,Erlang Public License v1.1,ErlPL-1.1,http://www.erlang.org/EPLICENSE,"This Erlang License is a derivative work of the Mozilla Public License, Version 1.0. It contains terms which differ from the Mozilla Public License, Version 1.0.",,"The contents of this file are subject to the Erlang Public License, Version 1.1, (the ""License""); you may not use this file except in compliance with the License. You should have received a copy of the Erlang Public License along with this software. If not, it can be retrieved via the world wide web at http://www.erlang.org/.Software distributed under the License is distributed on an ""AS IS"" basis, WITHOUT WARRANTY OF ANY KIND, either express or implied. See the License for the specific language governing rights and limitations under the License.The Initial Developer of the Original Code is Ericsson Utvecklings AB.  Portions created by Ericsson are Copyright 1999, Ericsson Utvecklings AB. All Rights Reserved.",ErlPL-1.1.txt,,,,,,"see MH comment added to Notes field; should we be calling it a ""derivative work""?  That is a legal term of art, and thus making an interpretation.  The second sentence would be enough to explain the relatioship perhaps.",do not add these notes (see 9/19/12 meeting minutes for discussion),,,,,,,,,,,,,,,,,,,,,,,,,,,,,,,,,,,,,,,,,,,,,,,,,,,,,,,,,,,,,,,,,,,,,,,,,,,,,,,,,,,,,,,,,,,,,,,,,,,,,,,,,,,,,,,,,,,,,,,,,,,,,,,,,,,,,,,,,,,,,,,,,,,,,,,,,,,,,,,,,,,,,,,,,,,,,,,,,,,,,,,,,,,,,,,,,,,,,,,,,,,,,,,,,,,,,,,,,,,,,,,,,,,,,,,,,,,,,,,,,,EU DataGrid Software License,EUDatagrid,"http://eu-datagrid.web.cern.ch/eu-datagrid/license.htmlhttp://www.opensource.org/licenses/EUDatagrid",,YES,,EUDatagrid.txt,,,,,,,,,,,,,,,,,,,,,,,,,,,,,,,,,,,,,,,,,,,,,,,,,,,,,,,,,,,,,,,,,,,,,,,,,,,,,,,,,,,,,,,,,,,,,,,,,,,,,,,,,,,,,,,,,,,,,,,,,,,,,,,,,,,,,,,,,,,,,,,,,,,,,,,,,,,,,,,,,,,,,,,,,,,,,,,,,,,,,,,,,,,,,,,,,,,,,,,,,,,,,,,,,,,,,,,,,,,,,,,,,,,,,,,,,,,,,,,,,,,,,,,,,European Union Public License 1.0,EUPL-1.0,"http://ec.europa.eu/idabc/en/document/7330.htmlhttp://ec.europa.eu/idabc/servlets/Doc027f.pdf?id=31096",The European Commission has approved the EUPL on 9 January 2007.,,,EUPL-1.0.txt,,,,,,"added Note re: EC approval of licensefirst link to page with list of all languages; second link to English version directly - do we need both?",,,,,,,,,,,,,,,,,,,,,,,,,,,,,,,,,,,,,,,,,,,,,,,,,,,,,,,,,,,,,,,,,,,,,,,,,,,,,,,,,,,,,,,,,,,,,,,,,,,,,,,,,,,,,,,,,,,,,,,,,,,,,,,,,,,,,,,,,,,,,,,,,,,,,,,,,,,,,,,,,,,,,,,,,,,,,,,,,,,,,,,,,,,,,,,,,,,,,,,,,,,,,,,,,,,,,,,,,,,,,,,,,,,,,,,,,,,,,,,,,,,European Union Public License 1.1,EUPL-1.1,"https://joinup.ec.europa.eu/software/page/eupl/licence-euplhttps://joinup.ec.europa.eu/system/files/EN/EUPL%20v.1.1%20-%20Licence.pdfhttp://www.opensource.org/licenses/EUPL-1.1","This license was released:  16 May 2008This license is available in the 22 official languages of the EU.  The English version is included here.",YES,,EUPL-1.1.txt,,,,,,links to both pages that lists all languages and the direct to English version - need both?,fine as is. Outstanding question as to whether matching guidelines to allow matching to any language and other language issues to-be-discussed,,,,,,,,,,,,,,,,,,,,,,,,,,,,,,,,,,,,,,,,,,,,,,,,,,,,,,,,,,,,,,,,,,,,,,,,,,,,,,,,,,,,,,,,,,,,,,,,,,,,,,,,,,,,,,,,,,,,,,,,,,,,,,,,,,,,,,,,,,,,,,,,,,,,,,,,,,,,,,,,,,,,,,,,,,,,,,,,,,,,,,,,,,,,,,,,,,,,,,,,,,,,,,,,,,,,,,,,,,,,,,,,,,,,,,,,,,,,,,,,,,Eurosym License,Eurosym,https://fedoraproject.org/wiki/Licensing/Eurosym,,,,Eurosym.txt,,,,,,,,,,NEW-Fedora,,,,,,,,,,,,,,,,,,,,,,,,,,,,,,,,,,,,,,,,,,,,,,,,,,,,,,,,,,,,,,,,,,,,,,,,,,,,,,,,,,,,,,,,,,,,,,,,,,,,,,,,,,,,,,,,,,,,,,,,,,,,,,,,,,,,,,,,,,,,,,,,,,,,,,,,,,,,,,,,,,,,,,,,,,,,,,,,,,,,,,,,,,,,,,,,,,,,,,,,,,,,,,,,,,,,,,,,,,,,,,,,,,,,,,,,,,,,,,,Fair License,Fair,http://www.opensource.org/licenses/Fair,,YES,,Fair.txt,,,,,,OSI issue resolved (OSI website),,,,,,,,,,,,,,,,,,,,,,,,,,,,,,,,,,,,,,,,,,,,,,,,,,,,,,,,,,,,,,,,,,,,,,,,,,,,,,,,,,,,,,,,,,,,,,,,,,,,,,,,,,,,,,,,,,,,,,,,,,,,,,,,,,,,,,,,,,,,,,,,,,,,,,,,,,,,,,,,,,,,,,,,,,,,,,,,,,,,,,,,,,,,,,,,,,,,,,,,,,,,,,,,,,,,,,,,,,,,,,,,,,,,,,,,,,,,,,,,,,,feh License,MIT-feh,https://fedoraproject.org/wiki/Licensing/MIT#feh,,,,MIT-feh.txt,,,,,,,,,,NEW-Fedora,,,,,,,,,,,,,,,,,,,,,,,,,,,,,,,,,,,,,,,,,,,,,,,,,,,,,,,,,,,,,,,,,,,,,,,,,,,,,,,,,,,,,,,,,,,,,,,,,,,,,,,,,,,,,,,,,,,,,,,,,,,,,,,,,,,,,,,,,,,,,,,,,,,,,,,,,,,,,,,,,,,,,,,,,,,,,,,,,,,,,,,,,,,,,,,,,,,,,,,,,,,,,,,,,,,,,,,,,,,,,,,,,,,,,,,,,,,,,,,Frameworx Open License 1.0,Frameworx-1.0,http://www.opensource.org/licenses/Frameworx-1.0,The url included in the license does not work. (15/10/10),YES,,Frameworx-1.0.txt,,,,,,link within license is no good - do we want to capture this info anywhere?,fine as is. Outstanding question as to whether matching guidelines to allow matching to any language and other language issues to-be-discussed,,,,,,,,,,,,,,,,,,,,,,,,,,,,,,,,,,,,,,,,,,,,,,,,,,,,,,,,,,,,,,,,,,,,,,,,,,,,,,,,,,,,,,,,,,,,,,,,,,,,,,,,,,,,,,,,,,,,,,,,,,,,,,,,,,,,,,,,,,,,,,,,,,,,,,,,,,,,,,,,,,,,,,,,,,,,,,,,,,,,,,,,,,,,,,,,,,,,,,,,,,,,,,,,,,,,,,,,,,,,,,,,,,,,,,,,,,,,,,,,,,FreeImage Public License v1.0,FreeImage,http://freeimage.sourceforge.net/freeimage-license.txt,"This is similar to MPL-1.0, but for the names, choice of law, and jurisdiction",,,FreeImage.txt,,,,,,,,,,,NEW,NEW,,,,,,,,,,,,,,,,,,,,,,,,,,,,,,,,,,,,,,,,,,,,,,,,,,,,,,,,,,,,,,,,,,,,,,,,,,,,,,,,,,,,,,,,,,,,,,,,,,,,,,,,,,,,,,,,,,,,,,,,,,,,,,,,,,,,,,,,,,,,,,,,,,,,,,,,,,,,,,,,,,,,,,,,,,,,,,,,,,,,,,,,,,,,,,,,,,,,,,,,,,,,,,,,,,,,,,,,,,,,,,,,,,,,,,,,,,,,,Freetype Project License,FTL,http://freetype.fis.uniroma2.it/FTL.TXT,This license was released 27 Jan 2006,,,FTL.txt,,,,,,,NEW,,,,,,,,,,,,,,,,,,,,,,,,,,,,,,,,,,,,,,,,,,,,,,,,,,,,,,,,,,,,,,,,,,,,,,,,,,,,,,,,,,,,,,,,,,,,,,,,,,,,,,,,,,,,,,,,,,,,,,,,,,,,,,,,,,,,,,,,,,,,,,,,,,,,,,,,,,,,,,,,,,,,,,,,,,,,,,,,,,,,,,,,,,,,,,,,,,,,,,,,,,,,,,,,,,,,,,,,,,,,,,,,,,,,,,,,,,,,,,,,,,FSF All Permissive License,FSFAP,http://www.gnu.org/prep/maintain/html_node/License-Notices-for-Other-Files.html,,,,FSFAP.txt,,,,,,,,,,NEW-Fedora,,,,,,,,,,,,,,,,,,,,,,,,,,,,,,,,,,,,,,,,,,,,,,,,,,,,,,,,,,,,,,,,,,,,,,,,,,,,,,,,,,,,,,,,,,,,,,,,,,,,,,,,,,,,,,,,,,,,,,,,,,,,,,,,,,,,,,,,,,,,,,,,,,,,,,,,,,,,,,,,,,,,,,,,,,,,,,,,,,,,,,,,,,,,,,,,,,,,,,,,,,,,,,,,,,,,,,,,,,,,,,,,,,,,,,,,,,,,,,,FSF Unlimited License,FSFUL,https://fedoraproject.org/wiki/Licensing/FSF_Unlimited_License,,,,FSFUL.txt,,,,,,,,,,NEW-Fedora,,,,,,,,,,,,,,,,,,,,,,,,,,,,,,,,,,,,,,,,,,,,,,,,,,,,,,,,,,,,,,,,,,,,,,,,,,,,,,,,,,,,,,,,,,,,,,,,,,,,,,,,,,,,,,,,,,,,,,,,,,,,,,,,,,,,,,,,,,,,,,,,,,,,,,,,,,,,,,,,,,,,,,,,,,,,,,,,,,,,,,,,,,,,,,,,,,,,,,,,,,,,,,,,,,,,,,,,,,,,,,,,,,,,,,,,,,,,,,,FSF Unlimited License (with License Retention),FSFULLR,https://fedoraproject.org/wiki/Licensing/FSF_Unlimited_License#License_Retention_Variant,,,,FSFULLR.txt,,,,,,,,,,NEW-Fedora,,,,,,,,,,,,,,,,,,,,,,,,,,,,,,,,,,,,,,,,,,,,,,,,,,,,,,,,,,,,,,,,,,,,,,,,,,,,,,,,,,,,,,,,,,,,,,,,,,,,,,,,,,,,,,,,,,,,,,,,,,,,,,,,,,,,,,,,,,,,,,,,,,,,,,,,,,,,,,,,,,,,,,,,,,,,,,,,,,,,,,,,,,,,,,,,,,,,,,,,,,,,,,,,,,,,,,,,,,,,,,,,,,,,,,,,,,,,,,,Giftware License,Giftware,http://alleg.sourceforge.net//license.html,This license may also be known as Allegro 4. The Allegro 5 license shown at the alleg.sourceforge.net URL is the same as zlib,,,Giftware.txt,,,,,,,,,,NEW-Fedora,,,,,,,,,,,,,,,,,,,,,,,,,,,,,,,,,,,,,,,,,,,,,,,,,,,,,,,,,,,,,,,,,,,,,,,,,,,,,,,,,,,,,,,,,,,,,,,,,,,,,,,,,,,,,,,,,,,,,,,,,,,,,,,,,,,,,,,,,,,,,,,,,,,,,,,,,,,,,,,,,,,,,,,,,,,,,,,,,,,,,,,,,,,,,,,,,,,,,,,,,,,,,,,,,,,,,,,,,,,,,,,,,,,,,,,,,,,,,,,GL2PS License,GL2PS,http://www.geuz.org/gl2ps/COPYING.GL2PS,,,,GL2PS.txt,,,,,,,,,,NEW-Fedora,,,,,,,,,,,,,,,,,,,,,,,,,,,,,,,,,,,,,,,,,,,,,,,,,,,,,,,,,,,,,,,,,,,,,,,,,,,,,,,,,,,,,,,,,,,,,,,,,,,,,,,,,,,,,,,,,,,,,,,,,,,,,,,,,,,,,,,,,,,,,,,,,,,,,,,,,,,,,,,,,,,,,,,,,,,,,,,,,,,,,,,,,,,,,,,,,,,,,,,,,,,,,,,,,,,,,,,,,,,,,,,,,,,,,,,,,,,,,,,Glulxe License,Glulxe,https://fedoraproject.org/wiki/Licensing/Glulxe,,,,Glulxe.txt,,,,H-YES,,carrots changed to square brackets in standard header,,,,,,,,,add markup to (c),,,,,,,,,,,,,,,,,,,,,,,,,,,,,,,,,,,,,,,,,,,,,,,,,,,,,,,,,,,,,,,,,,,,,,,,,,,,,,,,,,,,,,,,,,,,,,,,,,,,,,,,,,,,,,,,,,,,,,,,,,,,,,,,,,,,,,,,,,,,,,,,,,,,,,,,,,,,,,,,,,,,,,,,,,,,,,,,,,,,,,,,,,,,,,,,,,,,,,,,,,,,,,,,,,,,,,,,,,,,,,,,,,,,,,,,,,GNU Affero General Public License v3.0,AGPL-3.0,"http://www.gnu.org/licenses/agpl.txthttp://www.opensource.org/licenses/AGPL-3.0",This version was released: 19 November 2007,YES,"Copyright (C) <<var;name=copyright;original=[year]  [name of author];match=.+>>This program is free software: you can redistribute it and/or modify it under the terms of the GNU Affero General Public License as published by the Free Software Foundation, version 3.This program is distributed in the hope that it will be useful, but WITHOUT ANY WARRANTY; without even the implied warranty of MERCHANTABILITY or FITNESS FOR A PARTICULAR PURPOSE.  See the GNU Affero General Public License for more details.You should have received a copy of the GNU Affero General Public License along with this program.  If not, see <http://www.gnu.org/licenses/>.",AGPL-3.0.txt,,,,H-YES,,,,,,,,,,,added markup for copyright notice only,,,,,,,,,,,,,,,,,,,,,,,,,,,,,,,,,,,,,,,,,,,,,,,,,,,,,,,,,,,,,,,,,,,,,,,,,,,,,,,,,,,,,,,,,,,,,,,,,,,,,,,,,,,,,,,,,,,,,,,,,,,,,,,,,,,,,,,,,,,,,,,,,,,,,,,,,,,,,,,,,,,,,,,,,,,,,,,,,,,,,,,,,,,,,,,,,,,,,,,,,,,,,,,,,,,,,,,,,,,,,,,,,,,,,,,,,,GNU Free Documentation License v1.1,GFDL-1.1,http://www.gnu.org/licenses/old-licenses/fdl-1.1.txt,This license was released March 2000,,"Copyright (c) <<var;name=copyright;original=YEAR YOUR NAME;match=.+>>.      Permission is granted to copy, distribute and/or modify this document under the terms of the GNU Free Documentation License, Version 1.1 or any later version published by the Free Software Foundation; with the Invariant Sections being LIST THEIR TITLES, with the Front-Cover Texts being LIST, and with the Back-Cover Texts being LIST.      A copy of the license is included in the section entitled ""GNU Free Documentation License"".",GFDL-1.1.txt,,,,H-YES,,,,,,,,,,,added markup for copyright notice only,,,,,,,,,,,,,,,,,,,,,,,,,,,,,,,,,,,,,,,,,,,,,,,,,,,,,,,,,,,,,,,,,,,,,,,,,,,,,,,,,,,,,,,,,,,,,,,,,,,,,,,,,,,,,,,,,,,,,,,,,,,,,,,,,,,,,,,,,,,,,,,,,,,,,,,,,,,,,,,,,,,,,,,,,,,,,,,,,,,,,,,,,,,,,,,,,,,,,,,,,,,,,,,,,,,,,,,,,,,,,,,,,,,,,,,,,,GNU Free Documentation License v1.2,GFDL-1.2,http://www.gnu.org/licenses/old-licenses/fdl-1.2.txt,This license was released November 2002,,"Copyright (c) <<var;name=copyright;original=YEAR YOUR NAME;match=.+>>.      Permission is granted to copy, distribute and/or modify this document under the terms of the GNU Free Documentation License, Version 1.2 or any later version published by the Free Software Foundation; with no Invariant Sections, no Front-Cover Texts, and no Back-Cover Texts.      A copy of the license is included in the section entitled ""GNU Free Documentation License"".",GFDL-1.2.txt,,,,H-YES,,,,,,,,,,,added markup for copyright notice only,,,,,,,,,,,,,,,,,,,,,,,,,,,,,,,,,,,,,,,,,,,,,,,,,,,,,,,,,,,,,,,,,,,,,,,,,,,,,,,,,,,,,,,,,,,,,,,,,,,,,,,,,,,,,,,,,,,,,,,,,,,,,,,,,,,,,,,,,,,,,,,,,,,,,,,,,,,,,,,,,,,,,,,,,,,,,,,,,,,,,,,,,,,,,,,,,,,,,,,,,,,,,,,,,,,,,,,,,,,,,,,,,,,,,,,,,,