Full name of License,License Identifier,Source/url,Notes,OSI Approved,Standard License Header,Template,License List Version,License List Release Date,,Markup in .txt file?,OSI questions or issues,Changes for v1.16 - issues,changes for v1.17,changes for v1.18,changes for v1.19,changes for v1.20,changes for v2.0rc2,changes for v2.0rc3 / 2.0,changes for v2.1,changes for v2.2,changes for v2.3,changes for v2.4,changes for v2.5,,,,,,,,,,,,,,,,,,,,,,,,,,,,,,,,,,,,,,,,,,,,,,,,,,,,,,,,,,,,,,,,,,,,,,,,,,,,,,,,,,,,,,,,,,,,,,,,,,,,,,,,,,,,,,,,,,,,,,,,,,,,,,,,,,,,,,,,,,,,,,,,,,,,,,,,,,,,,,,,,,,,,,,,,,,,,,,,,,,,,,,,,,,,,,,,,,,,,,,,,,,,,,,,,,,,,,,,,,,,,,,,,,,,,,,,3dfx Glide License,Glide,http://www.users.on.net/~triforce/glidexp/COPYING.txt,,,,Glide.txt,2.5,2016-06-30,,,,,,,,NEW-Fedora,,,,,,,,,,,,,,,,,,,,,,,,,,,,,,,,,,,,,,,,,,,,,,,,,,,,,,,,,,,,,,,,,,,,,,,,,,,,,,,,,,,,,,,,,,,,,,,,,,,,,,,,,,,,,,,,,,,,,,,,,,,,,,,,,,,,,,,,,,,,,,,,,,,,,,,,,,,,,,,,,,,,,,,,,,,,,,,,,,,,,,,,,,,,,,,,,,,,,,,,,,,,,,,,,,,,,,,,,,,,,,,,,,,,,,,,,,,,,,,Abstyles License,Abstyles,https://fedoraproject.org/wiki/Licensing/Abstyles,,,,Abstyles.txt,,,,,,,,,,NEW-Fedora,,,,,,,,,,,,,,,,,,,,,,,,,,,,,,,,,,,,,,,,,,,,,,,,,,,,,,,,,,,,,,,,,,,,,,,,,,,,,,,,,,,,,,,,,,,,,,,,,,,,,,,,,,,,,,,,,,,,,,,,,,,,,,,,,,,,,,,,,,,,,,,,,,,,,,,,,,,,,,,,,,,,,,,,,,,,,,,,,,,,,,,,,,,,,,,,,,,,,,,,,,,,,,,,,,,,,,,,,,,,,,,,,,,,,,,,,,,,,,,Academic Free License v1.1,AFL-1.1,http://opensource.linux-mirror.org/licenses/afl-1.1.txt,This license has been superseded by later versions.,YES,Licensed under the Academic Free License version 1.1.,AFL-1.1.txt,,,,,OSI mirror link no longer works; not on OSI site,OSI issue resolved - is OSI approved;  may still need to update link later when OSI,,,,,,,,,,,,,,,,,,,,,,,,,,,,,,,,,,,,,,,,,,,,,,,,,,,,,,,,,,,,,,,,,,,,,,,,,,,,,,,,,,,,,,,,,,,,,,,,,,,,,,,,,,,,,,,,,,,,,,,,,,,,,,,,,,,,,,,,,,,,,,,,,,,,,,,,,,,,,,,,,,,,,,,,,,,,,,,,,,,,,,,,,,,,,,,,,,,,,,,,,,,,,,,,,,,,,,,,,,,,,,,,,,,,,,,,,,,,,,,,,,,Academic Free License v1.2,AFL-1.2,http://opensource.linux-mirror.org/licenses/afl-1.2.txt,This license has been superseded by later versions.,YES,Licensed under the Academic Free License version 1.2,AFL-1.2.txt,,,,,OSI mirror link no longer works; not on OSI site,OSI issue resolved - is OSI approved;  may still need to update link later when OSI,,,,,,,,,,,,,,,,,,,,,,,,,,,,,,,,,,,,,,,,,,,,,,,,,,,,,,,,,,,,,,,,,,,,,,,,,,,,,,,,,,,,,,,,,,,,,,,,,,,,,,,,,,,,,,,,,,,,,,,,,,,,,,,,,,,,,,,,,,,,,,,,,,,,,,,,,,,,,,,,,,,,,,,,,,,,,,,,,,,,,,,,,,,,,,,,,,,,,,,,,,,,,,,,,,,,,,,,,,,,,,,,,,,,,,,,,,,,,,,,,,,Academic Free License v2.0,AFL-2.0,http://opensource.linux-mirror.org/licenses/afl-2.0.txt,,YES,Licensed under the Academic Free License version 2.0,AFL-2.0.txt,,,,,OSI mirror link no longer works; not on OSI site,OSI issue resolved - is OSI approved;  may still need to update link later when OSI,,,,,,,,,,,,,,,,,,,,,,,,,,,,,,,,,,,,,,,,,,,,,,,,,,,,,,,,,,,,,,,,,,,,,,,,,,,,,,,,,,,,,,,,,,,,,,,,,,,,,,,,,,,,,,,,,,,,,,,,,,,,,,,,,,,,,,,,,,,,,,,,,,,,,,,,,,,,,,,,,,,,,,,,,,,,,,,,,,,,,,,,,,,,,,,,,,,,,,,,,,,,,,,,,,,,,,,,,,,,,,,,,,,,,,,,,,,,,,,,,,,Academic Free License v2.1,AFL-2.1,http://opensource.linux-mirror.org/licenses/afl-2.1.txt,,YES,Licensed under the Academic Free License version 2.1,AFL-2.1.txt,,,,,OSI mirror link no longer works; not on OSI site,OSI issue resolved - is OSI approved;  may still need to update link later when OSI,,,,,,,,,,,,,,,,,,,,,,,,,,,,,,,,,,,,,,,,,,,,,,,,,,,,,,,,,,,,,,,,,,,,,,,,,,,,,,,,,,,,,,,,,,,,,,,,,,,,,,,,,,,,,,,,,,,,,,,,,,,,,,,,,,,,,,,,,,,,,,,,,,,,,,,,,,,,,,,,,,,,,,,,,,,,,,,,,,,,,,,,,,,,,,,,,,,,,,,,,,,,,,,,,,,,,,,,,,,,,,,,,,,,,,,,,,,,,,,,,,,Academic Free License v3.0,AFL-3.0,"http://www.rosenlaw.com/AFL3.0.htmhttp://www.opensource.org/licenses/afl-3.0",,YES,Licensed under the Academic Free License version 3.0,AFL-3.0.txt,,,,,,,,,,,,,,,,,,,,,,,,,,,,,,,,,,,,,,,,,,,,,,,,,,,,,,,,,,,,,,,,,,,,,,,,,,,,,,,,,,,,,,,,,,,,,,,,,,,,,,,,,,,,,,,,,,,,,,,,,,,,,,,,,,,,,,,,,,,,,,,,,,,,,,,,,,,,,,,,,,,,,,,,,,,,,,,,,,,,,,,,,,,,,,,,,,,,,,,,,,,,,,,,,,,,,,,,,,,,,,,,,,,,,,,,,,,,,,,,,,,,,,,,,Academy of Motion Picture Arts and Sciences BSD,AMPAS,https://fedoraproject.org/wiki/Licensing/BSD#AMPASBSD,,,,AMPAS.txt,,,,,,,,,,NEW-Fedora,,,,,,,,,,,,,,,,,,,,,,,,,,,,,,,,,,,,,,,,,,,,,,,,,,,,,,,,,,,,,,,,,,,,,,,,,,,,,,,,,,,,,,,,,,,,,,,,,,,,,,,,,,,,,,,,,,,,,,,,,,,,,,,,,,,,,,,,,,,,,,,,,,,,,,,,,,,,,,,,,,,,,,,,,,,,,,,,,,,,,,,,,,,,,,,,,,,,,,,,,,,,,,,,,,,,,,,,,,,,,,,,,,,,,,,,,,,,,,,Adaptive Public License 1.0,APL-1.0,http://www.opensource.org/licenses/APL-1.0,,YES,<various notices depending on terms chosen for license - see Exhibit A>,APL-1.0.txt,,,,,,,,,,,,,,,,,,,,,,,,,,,,,,,,,,,,,,,,,,,,,,,,,,,,,,,,,,,,,,,,,,,,,,,,,,,,,,,,,,,,,,,,,,,,,,,,,,,,,,,,,,,,,,,,,,,,,,,,,,,,,,,,,,,,,,,,,,,,,,,,,,,,,,,,,,,,,,,,,,,,,,,,,,,,,,,,,,,,,,,,,,,,,,,,,,,,,,,,,,,,,,,,,,,,,,,,,,,,,,,,,,,,,,,,,,,,,,,,,,,,,,,,,Adobe Glyph List License,Adobe-Glyph,https://fedoraproject.org/wiki/Licensing/MIT#AdobeGlyph,,,,Adobe-Glyph.txt,,,,,,,,,,NEW-Fedora,,,,,,,,,,,,,,,,,,,,,,,,,,,,,,,,,,,,,,,,,,,,,,,,,,,,,,,,,,,,,,,,,,,,,,,,,,,,,,,,,,,,,,,,,,,,,,,,,,,,,,,,,,,,,,,,,,,,,,,,,,,,,,,,,,,,,,,,,,,,,,,,,,,,,,,,,,,,,,,,,,,,,,,,,,,,,,,,,,,,,,,,,,,,,,,,,,,,,,,,,,,,,,,,,,,,,,,,,,,,,,,,,,,,,,,,,,,,,,,Adobe Postscript AFM License,APAFML,https://fedoraproject.org/wiki/Licensing/AdobePostscriptAFM,,,,APAFML.txt,,,,,,,,,,NEW-Fedora,,,,,,,,,,,,,,,,,,,,,,,,,,,,,,,,,,,,,,,,,,,,,,,,,,,,,,,,,,,,,,,,,,,,,,,,,,,,,,,,,,,,,,,,,,,,,,,,,,,,,,,,,,,,,,,,,,,,,,,,,,,,,,,,,,,,,,,,,,,,,,,,,,,,,,,,,,,,,,,,,,,,,,,,,,,,,,,,,,,,,,,,,,,,,,,,,,,,,,,,,,,,,,,,,,,,,,,,,,,,,,,,,,,,,,,,,,,,,,,Adobe Systems Incorporated Source Code License Agreement,Adobe-2006,https://fedoraproject.org/wiki/Licensing/AdobeLicense,,,,Adobe-2006.txt,,,,,,,,,,NEW-Fedora,,,,,,,,,,,,,,,,,,,,,,,,,,,,,,,,,,,,,,,,,,,,,,,,,,,,,,,,,,,,,,,,,,,,,,,,,,,,,,,,,,,,,,,,,,,,,,,,,,,,,,,,,,,,,,,,,,,,,,,,,,,,,,,,,,,,,,,,,,,,,,,,,,,,,,,,,,,,,,,,,,,,,,,,,,,,,,,,,,,,,,,,,,,,,,,,,,,,,,,,,,,,,,,,,,,,,,,,,,,,,,,,,,,,,,,,,,,,,,,Affero General Public License v1.0,AGPL-1.0,http://www.affero.org/oagpl.html,,,,AGPL-1.0.txt,,,,,,,,NEW,,"full name amended to remove ""GNU"" as that only applies to version 3 of this license",,,,,,,,,,,,,,,,,,,,,,,,,,,,,,,,,,,,,,,,,,,,,,,,,,,,,,,,,,,,,,,,,,,,,,,,,,,,,,,,,,,,,,,,,,,,,,,,,,,,,,,,,,,,,,,,,,,,,,,,,,,,,,,,,,,,,,,,,,,,,,,,,,,,,,,,,,,,,,,,,,,,,,,,,,,,,,,,,,,,,,,,,,,,,,,,,,,,,,,,,,,,,,,,,,,,,,,,,,,,,,,,,,,,,,,,,,,,,,,Afmparse License,Afmparse,https://fedoraproject.org/wiki/Licensing/Afmparse,,,,Afmparse.txt,,,,,,,,,,NEW-Fedora,,,,,,,,,,,,,,,,,,,,,,,,,,,,,,,,,,,,,,,,,,,,,,,,,,,,,,,,,,,,,,,,,,,,,,,,,,,,,,,,,,,,,,,,,,,,,,,,,,,,,,,,,,,,,,,,,,,,,,,,,,,,,,,,,,,,,,,,,,,,,,,,,,,,,,,,,,,,,,,,,,,,,,,,,,,,,,,,,,,,,,,,,,,,,,,,,,,,,,,,,,,,,,,,,,,,,,,,,,,,,,,,,,,,,,,,,,,,,,,Aladdin Free Public License,Aladdin,http://pages.cs.wisc.edu/~ghost/doc/AFPL/6.01/Public.htm,This license was released 18 Nov 1999,,,Aladdin.txt,,,,,,,NEW,,,,,,,,,,,,,,,,,,,,,,,,,,,,,,,,,,,,,,,,,,,,,,,,,,,,,,,,,,,,,,,,,,,,,,,,,,,,,,,,,,,,,,,,,,,,,,,,,,,,,,,,,,,,,,,,,,,,,,,,,,,,,,,,,,,,,,,,,,,,,,,,,,,,,,,,,,,,,,,,,,,,,,,,,,,,,,,,,,,,,,,,,,,,,,,,,,,,,,,,,,,,,,,,,,,,,,,,,,,,,,,,,,,,,,,,,,,,,,,,,,Amazon Digital Services License,ADSL,https://fedoraproject.org/wiki/Licensing/AmazonDigitalServicesLicense,,,,ADSL.txt,,,,,,,,,,NEW-Fedora,,,,,,,,,,,,,,,,,,,,,,,,,,,,,,,,,,,,,,,,,,,,,,,,,,,,,,,,,,,,,,,,,,,,,,,,,,,,,,,,,,,,,,,,,,,,,,,,,,,,,,,,,,,,,,,,,,,,,,,,,,,,,,,,,,,,,,,,,,,,,,,,,,,,,,,,,,,,,,,,,,,,,,,,,,,,,,,,,,,,,,,,,,,,,,,,,,,,,,,,,,,,,,,,,,,,,,,,,,,,,,,,,,,,,,,,,,,,,,,AMD's plpa_map.c License,AMDPLPA,https://fedoraproject.org/wiki/Licensing/AMD_plpa_map_License,,,,AMDPLPA.txt,,,,,,,,,,NEW-Fedora,,,,,,,,,,,,,,,,,,,,,,,,,,,,,,,,,,,,,,,,,,,,,,,,,,,,,,,,,,,,,,,,,,,,,,,,,,,,,,,,,,,,,,,,,,,,,,,,,,,,,,,,,,,,,,,,,,,,,,,,,,,,,,,,,,,,,,,,,,,,,,,,,,,,,,,,,,,,,,,,,,,,,,,,,,,,,,,,,,,,,,,,,,,,,,,,,,,,,,,,,,,,,,,,,,,,,,,,,,,,,,,,,,,,,,,,,,,,,,,ANTLR Software Rights Notice,ANTLR-PD,http://www.antlr2.org/license.html,ANTLR used this public domain notice through version 2.7 and then switched to a BSD license for version 3.0 and later.,,,ANTLR-PD.txt,,,,,,,,,,,,,,,,,,,,,,,,,,,,,,,,,,,,,,,,,,,,,,,,,,,,,,,,,,,,,,,,,,,,,,,,,,,,,,,,,,,,,,,,,,,,,,,,,,,,,,,,,,,,,,,,,,,,,,,,,,,,,,,,,,,,,,,,,,,,,,,,,,,,,,,,,,,,,,,,,,,,,,,,,,,,,,,,,,,,,,,,,,,,,,,,,,,,,,,,,,,,,,,,,,,,,,,,,,,,,,,,,,,,,,,,,,,,,,,,,,,,,,,,,Apache License 1.0,Apache-1.0,http://www.apache.org/licenses/LICENSE-1.0,,,,Apache-1.0.txt,,,,YES,,OSI issue resolved; was not OSI approved,,,,,,,,,,,,,,,,,,,,,,,,,,,,,,,,,,,,,,,,,,,,,,,,,,,,,,,,,,,,,,,,,,,,,,,,,,,,,,,,,,,,,,,,,,,,,,,,,,,,,,,,,,,,,,,,,,,,,,,,,,,,,,,,,,,,,,,,,,,,,,,,,,,,,,,,,,,,,,,,,,,,,,,,,,,,,,,,,,,,,,,,,,,,,,,,,,,,,,,,,,,,,,,,,,,,,,,,,,,,,,,,,,,,,,,,,,,,,,,,,,,Apache License 1.1,Apache-1.1,"http://apache.org/licenses/LICENSE-1.1http://opensource.org/licenses/Apache-1.1",This license has been superseded by Apache License 2.0,YES,,Apache-1.1.txt,,,,YES,may need to update OSI link later,,,OSI url updated,,,,,,,,,,,,,,,,,,,,,,,,,,,,,,,,,,,,,,,,,,,,,,,,,,,,,,,,,,,,,,,,,,,,,,,,,,,,,,,,,,,,,,,,,,,,,,,,,,,,,,,,,,,,,,,,,,,,,,,,,,,,,,,,,,,,,,,,,,,,,,,,,,,,,,,,,,,,,,,,,,,,,,,,,,,,,,,,,,,,,,,,,,,,,,,,,,,,,,,,,,,,,,,,,,,,,,,,,,,,,,,,,,,,,,,,,,,,,,,,,Apache License 2.0,Apache-2.0,"http://www.apache.org/licenses/LICENSE-2.0http://www.opensource.org/licenses/Apache-2.0",This license was released January 2004,YES,"Copyright <<var;name=copyright;original=[yyyy] [name of copyright owner];match=.+>>Licensed under the Apache License, Version 2.0 (the ""License""); you may not use this file except in compliance with the License. You may obtain a copy of the License at     http://www.apache.org/licenses/LICENSE-2.0Unless required by applicable law or agreed to in writing, software distributed under the License is distributed on an ""AS IS"" BASIS, WITHOUT WARRANTIES OR CONDITIONS OF ANY KIND, either express or implied. See the License for the specific language governing permissions and limitations under the License.",Apache-2.0.txt,,,,H-YES,,,,,,,,,updated header to be correct,,added markup to standard header,,,,,,,,,,,,,,,,,,,,,,,,,,,,,,,,,,,,,,,,,,,,,,,,,,,,,,,,,,,,,,,,,,,,,,,,,,,,,,,,,,,,,,,,,,,,,,,,,,,,,,,,,,,,,,,,,,,,,,,,,,,,,,,,,,,,,,,,,,,,,,,,,,,,,,,,,,,,,,,,,,,,,,,,,,,,,,,,,,,,,,,,,,,,,,,,,,,,,,,,,,,,,,,,,,,,,,,,,,,,,,,,,,,,,,,,,,Apple MIT License,AML,https://fedoraproject.org/wiki/Licensing/Apple_MIT_License,,,,AML.txt,,,,,,,,,,NEW-Fedora,,,,,,,,,,,,,,,,,,,,,,,,,,,,,,,,,,,,,,,,,,,,,,,,,,,,,,,,,,,,,,,,,,,,,,,,,,,,,,,,,,,,,,,,,,,,,,,,,,,,,,,,,,,,,,,,,,,,,,,,,,,,,,,,,,,,,,,,,,,,,,,,,,,,,,,,,,,,,,,,,,,,,,,,,,,,,,,,,,,,,,,,,,,,,,,,,,,,,,,,,,,,,,,,,,,,,,,,,,,,,,,,,,,,,,,,,,,,,,,Apple Public Source License 1.0,APSL-1.0,https://fedoraproject.org/wiki/Licensing/Apple_Public_Source_License_1.0,This license was released 16 March 1999.,YES,"Portions Copyright (c) 1999 Apple Computer, Inc. All Rights Reserved. This file contains Original Code and/or Modifications of Original Code as defined in and that are subject to the Apple Public Source License Version 1.0 (the 'License'). You may not use this file except in compliance with the License. Please obtain a copy of the License at http://www.apple.com/publicsource and read it before using this file.The Original Code and all software distributed under the License are distributed on an 'AS IS' basis, WITHOUT WARRANTY OF ANY KIND, EITHER EXPRESS OR IMPLIED, AND APPLE HEREBY DISCLAIMS ALL SUCH WARRANTIES, INCLUDING WITHOUT LIMITATION, ANY WARRANTIES OF MERCHANTABILITY, FITNESS FOR A PARTICULAR PURPOSE OR NON-INFRINGEMENT. Please see the License for the specific language governing rights and limitations under the License.",APSL-1.0.txt,,,,,was this ever OSI approved?,,,"yes, it was OSI approved",,,,,,,,,,,,,,,,,,,,,,,,,,,,,,,,,,,,,,,,,,,,,,,,,,,,,,,,,,,,,,,,,,,,,,,,,,,,,,,,,,,,,,,,,,,,,,,,,,,,,,,,,,,,,,,,,,,,,,,,,,,,,,,,,,,,,,,,,,,,,,,,,,,,,,,,,,,,,,,,,,,,,,,,,,,,,,,,,,,,,,,,,,,,,,,,,,,,,,,,,,,,,,,,,,,,,,,,,,,,,,,,,,,,,,,,,,,,,,,,,Apple Public Source License 1.1,APSL-1.1,http://www.opensource.apple.com/source/IOSerialFamily/IOSerialFamily-7/APPLE_LICENSE,This license was released 19 April 1999.,YES,"Portions Copyright (c) 1999-2000 Apple Computer, Inc.  All Rights Reserved.  This file contains Original Code and/or Modifications of Original Code as defined in and that are subject to the Apple Public Source License Version 1.1 (the ""License"").  You may not use this file except in compliance with the License.  Please obtain a copy of the License at http://www.apple.com/publicsource and read it before using this file.The Original Code and all software distributed under the License are distributed on an ""AS IS"" basis, WITHOUT WARRANTY OF ANY KIND, EITHER EXPRESS OR IMPLIED, AND APPLE HEREBY DISCLAIMS ALL SUCH WARRANTIES, INCLUDING WITHOUT LIMITATION, ANY WARRANTIES OF MERCHANTABILITY, FITNESS FOR A PARTICULAR PURPOSE OR NON- INFRINGEMENT.  Please see the License for the specific language governing rights and limitations under the License.",APSL-1.1.txt,,,,,was this ever OSI approved?,,,"yes, it was OSI approved",,,,,,,,,,,,,,,,,,,,,,,,,,,,,,,,,,,,,,,,,,,,,,,,,,,,,,,,,,,,,,,,,,,,,,,,,,,,,,,,,,,,,,,,,,,,,,,,,,,,,,,,,,,,,,,,,,,,,,,,,,,,,,,,,,,,,,,,,,,,,,,,,,,,,,,,,,,,,,,,,,,,,,,,,,,,,,,,,,,,,,,,,,,,,,,,,,,,,,,,,,,,,,,,,,,,,,,,,,,,,,,,,,,,,,,,,,,,,,,,,Apple Public Source License 1.2,APSL-1.2,http://www.samurajdata.se/opensource/mirror/licenses/apsl.php,This license was released 4 Jan 2001.,YES,"Portions Copyright (c) 1999-2001 Apple Computer, Inc. All Rights Reserved.This file contains Original Code and/or Modifications of Original Code as defined in and that are subject to the Apple Public Source License Version 1.2 (the 'License'). You may not use this file except in compliance with the License. Please obtain a copy of the License at http://www.apple.com/publicsource and read it before using this file.The Original Code and all software distributed under the License are distributed on an 'AS IS' basis, WITHOUT WARRANTY OF ANY KIND, EITHER EXPRESS OR IMPLIED, AND APPLE HEREBY DISCLAIMS ALL SUCH WARRANTIES, INCLUDING WITHOUT LIMITATION, ANY WARRANTIES OF MERCHANTABILITY, FITNESS FOR A PARTICULAR PURPOSE, QUIET ENJOYMENT OR NON-INFRINGEMENT. Please see the License for the specific language governing rights and limitations under the License.",APSL-1.2.txt,,,,,not on OSI site,"OSI issue resolved,was OSI approved",,,,,,,,,,,,,,,,,,,,,,,,,,,,,,,,,,,,,,,,,,,,,,,,,,,,,,,,,,,,,,,,,,,,,,,,,,,,,,,,,,,,,,,,,,,,,,,,,,,,,,,,,,,,,,,,,,,,,,,,,,,,,,,,,,,,,,,,,,,,,,,,,,,,,,,,,,,,,,,,,,,,,,,,,,,,,,,,,,,,,,,,,,,,,,,,,,,,,,,,,,,,,,,,,,,,,,,,,,,,,,,,,,,,,,,,,,,,,,,,,,,Apple Public Source License 2.0,APSL-2.0,http://www.opensource.apple.com/license/apsl/,This license was released: 6 August 2003.,YES,"Portions Copyright (c) 1999-2003 Apple Computer, Inc. All Rights Reserved.This file contains Original Code and/or Modifications of Original Code as defined in and that are subject to the Apple Public Source License Version 2.0 (the 'License'). You may not use this file except in compliance with the License. Please obtain a copy of the License at http://www.opensource.apple.com/apsl/ and read it before using this file.The Original Code and all software distributed under the License are distributed on an 'AS IS' basis, WITHOUT WARRANTY OF ANY KIND, EITHER EXPRESS OR IMPLIED, AND APPLE HEREBY DISCLAIMS ALL SUCH WARRANTIES, INCLUDING WITHOUT LIMITATION, ANY WARRANTIES OF MERCHANTABILITY, FITNESS FOR A PARTICULAR PURPOSE, QUIET ENJOYMENT OR NON-INFRINGEMENT. Please see the License for the specific language governing rights an limitations under the License.""",APSL-2.0.txt,,,,,,,,,,,,,,,,,,,,,,,,,,,,,,,,,,,,,,,,,,,,,,,,,,,,,,,,,,,,,,,,,,,,,,,,,,,,,,,,,,,,,,,,,,,,,,,,,,,,,,,,,,,,,,,,,,,,,,,,,,,,,,,,,,,,,,,,,,,,,,,,,,,,,,,,,,,,,,,,,,,,,,,,,,,,,,,,,,,,,,,,,,,,,,,,,,,,,,,,,,,,,,,,,,,,,,,,,,,,,,,,,,,,,,,,,,,,,,,,,,,,,,,,,Artistic License 1.0,Artistic-1.0,http://opensource.org/licenses/Artistic-1.0,"This license was superseded by v2.0This is Artistic License 1.0 as found on OSI site, excluding clause 8.",YES,,Artistic-1.0.txt,,,,,need to add Artistic License (Perl) 1.0 (Artistic-Perl-1.0)?Sorting this issue w/ OSI as to which version is correct (OSI site or Perl site) for this license.  Perl is also OSI approved. - resolved as of v1.19,,,,updated notes to clarify different variations of Artistic 1.0 license and url,,,,,,,,,,,,,,,,,,,,,,,,,,,,,,,,,,,,,,,,,,,,,,,,,,,,,,,,,,,,,,,,,,,,,,,,,,,,,,,,,,,,,,,,,,,,,,,,,,,,,,,,,,,,,,,,,,,,,,,,,,,,,,,,,,,,,,,,,,,,,,,,,,,,,,,,,,,,,,,,,,,,,,,,,,,,,,,,,,,,,,,,,,,,,,,,,,,,,,,,,,,,,,,,,,,,,,,,,,,,,,,,,,,,,,,,,,,,,,,,Artistic License 1.0 (Perl),Artistic-1.0-Perl,http://dev.perl.org/licenses/artistic.html,"This is the Artistic License 1.0 found on the Perl site, which is different (particularly, clauses 5, 6, 7 and 8) than the Artistic License 1.0 w/clause 8 found on the OSI site.",YES,,Artistic-1.0-Perl.txt,,,,,,,,,NEW (note: OSI link not included because it does not contain the same license text as the Perl site),added file name for license .txt file as it was missing and breaking the generation of corresponding HTML page,,,,,,,,,,,,,,,,,,,,,,,,,,,,,,,,,,,,,,,,,,,,,,,,,,,,,,,,,,,,,,,,,,,,,,,,,,,,,,,,,,,,,,,,,,,,,,,,,,,,,,,,,,,,,,,,,,,,,,,,,,,,,,,,,,,,,,,,,,,,,,,,,,,,,,,,,,,,,,,,,,,,,,,,,,,,,,,,,,,,,,,,,,,,,,,,,,,,,,,,,,,,,,,,,,,,,,,,,,,,,,,,,,,,,,,,,,,,,,,Artistic License 1.0 w/clause 8,Artistic-1.0-cl8,http://opensource.org/licenses/Artistic-1.0,"This license was superseded by v2.0This is Artistic License 1.0 as found on OSI site, including clause 8.",YES,,Artistic-1.0-cl8.txt,,,,,,,,,NEW,added file name for license .txt file as it was missing and breaking the generation of corresponding HTML page,,,,,,,,,,,,,,,,,,,,,,,,,,,,,,,,,,,,,,,,,,,,,,,,,,,,,,,,,,,,,,,,,,,,,,,,,,,,,,,,,,,,,,,,,,,,,,,,,,,,,,,,,,,,,,,,,,,,,,,,,,,,,,,,,,,,,,,,,,,,,,,,,,,,,,,,,,,,,,,,,,,,,,,,,,,,,,,,,,,,,,,,,,,,,,,,,,,,,,,,,,,,,,,,,,,,,,,,,,,,,,,,,,,,,,,,,,,,,,,Artistic License 2.0,Artistic-2.0,"http://www.perlfoundation.org/artistic_license_2_0  http://www.opensource.org/licenses/artistic-license-2.0",This license was released: 2006,YES,,Artistic-2.0.txt,,,,,,,,,,,,,,,,,,,,,,,,,,,,,,,,,,,,,,,,,,,,,,,,,,,,,,,,,,,,,,,,,,,,,,,,,,,,,,,,,,,,,,,,,,,,,,,,,,,,,,,,,,,,,,,,,,,,,,,,,,,,,,,,,,,,,,,,,,,,,,,,,,,,,,,,,,,,,,,,,,,,,,,,,,,,,,,,,,,,,,,,,,,,,,,,,,,,,,,,,,,,,,,,,,,,,,,,,,,,,,,,,,,,,,,,,,,,,,,,,,,,,,,,,Attribution Assurance License,AAL,http://www.opensource.org/licenses/attribution,This license was released: 2002,YES,,AAL.txt,,,,YES,,,,,,,,,,,,,,,,,,,,,,,,,,,,,,,,,,,,,,,,,,,,,,,,,,,,,,,,,,,,,,,,,,,,,,,,,,,,,,,,,,,,,,,,,,,,,,,,,,,,,,,,,,,,,,,,,,,,,,,,,,,,,,,,,,,,,,,,,,,,,,,,,,,,,,,,,,,,,,,,,,,,,,,,,,,,,,,,,,,,,,,,,,,,,,,,,,,,,,,,,,,,,,,,,,,,,,,,,,,,,,,,,,,,,,,,,,,,,,,,,,,,,Bahyph License,Bahyph,https://fedoraproject.org/wiki/Licensing/Bahyph,,,,Bahyph.txt,,,,,,,,,,NEW-Fedora,,,,,,,,,,,,,,,,,,,,,,,,,,,,,,,,,,,,,,,,,,,,,,,,,,,,,,,,,,,,,,,,,,,,,,,,,,,,,,,,,,,,,,,,,,,,,,,,,,,,,,,,,,,,,,,,,,,,,,,,,,,,,,,,,,,,,,,,,,,,,,,,,,,,,,,,,,,,,,,,,,,,,,,,,,,,,,,,,,,,,,,,,,,,,,,,,,,,,,,,,,,,,,,,,,,,,,,,,,,,,,,,,,,,,,,,,,,,,,,Barr License,Barr,https://fedoraproject.org/wiki/Licensing/Barr,,,,Barr.txt,,,,,,,,,,NEW-Fedora,,,,,,,,,,,,,,,,,,,,,,,,,,,,,,,,,,,,,,,,,,,,,,,,,,,,,,,,,,,,,,,,,,,,,,,,,,,,,,,,,,,,,,,,,,,,,,,,,,,,,,,,,,,,,,,,,,,,,,,,,,,,,,,,,,,,,,,,,,,,,,,,,,,,,,,,,,,,,,,,,,,,,,,,,,,,,,,,,,,,,,,,,,,,,,,,,,,,,,,,,,,,,,,,,,,,,,,,,,,,,,,,,,,,,,,,,,,,,,,Beerware License,Beerware,https://fedoraproject.org/wiki/Licensing/Beerware,,,,Beerware.txt,,,,,,,,,,NEW-Fedora,,,,,,,,,,,,,,,,,,,,,,,,,,,,,,,,,,,,,,,,,,,,,,,,,,,,,,,,,,,,,,,,,,,,,,,,,,,,,,,,,,,,,,,,,,,,,,,,,,,,,,,,,,,,,,,,,,,,,,,,,,,,,,,,,,,,,,,,,,,,,,,,,,,,,,,,,,,,,,,,,,,,,,,,,,,,,,,,,,,,,,,,,,,,,,,,,,,,,,,,,,,,,,,,,,,,,,,,,,,,,,,,,,,,,,,,,,,,,,,BitTorrent Open Source License v1.0,BitTorrent-1.0,http://sources.gentoo.org/cgi-bin/viewvc.cgi/gentoo-x86/licenses/BitTorrent?r1=1.1&r2=1.1.1.1&diff_format=s,,,"The contents of this file are subject to the BitTorrent Open Source License Version 1.0 (the License).  You may not copy or use this file, in either source code or executable form, except in compliance with the License.  You may obtain a copy of the License at http://www.bittorrent.com/license/.   Software distributed under the License is distributed on an AS IS basis, WITHOUT WARRANTY OF ANY KIND, either express or implied.  See the License for the specific language governing rights and limitations under the License. ",BitTorrent-1.0.txt,,,,,,,NEW,,,,,,,added standard header,,,,,,,,,,,,,,,,,,,,,,,,,,,,,,,,,,,,,,,,,,,,,,,,,,,,,,,,,,,,,,,,,,,,,,,,,,,,,,,,,,,,,,,,,,,,,,,,,,,,,,,,,,,,,,,,,,,,,,,,,,,,,,,,,,,,,,,,,,,,,,,,,,,,,,,,,,,,,,,,,,,,,,,,,,,,,,,,,,,,,,,,,,,,,,,,,,,,,,,,,,,,,,,,,,,,,,,,,,,,,,,,,,,,,,,,,,,BitTorrent Open Source License v1.1,BitTorrent-1.1,http://directory.fsf.org/wiki/License:BitTorrentOSL1.1,Standard header seems to use wrong version number (this is how it appears on all references found.),,"The contents of this file are subject to the BitTorrent Open Source License Version 1.0 (the License). You may not copy or use this file, in either source code or executable form, except in compliance with the License. You may obtain a copy of the License at http://www.bittorrent.com/license/.Software distributed under the License is distributed on an AS IS basis, WITHOUT WARRANTY OF ANY KIND, either express or implied. See the License for the specific language governing rights and limitations under the License.",BitTorrent-1.1.txt,,,,,,,NEW,,,,,,,added standard header and note,,,,,,,,,,,,,,,,,,,,,,,,,,,,,,,,,,,,,,,,,,,,,,,,,,,,,,,,,,,,,,,,,,,,,,,,,,,,,,,,,,,,,,,,,,,,,,,,,,,,,,,,,,,,,,,,,,,,,,,,,,,,,,,,,,,,,,,,,,,,,,,,,,,,,,,,,,,,,,,,,,,,,,,,,,,,,,,,,,,,,,,,,,,,,,,,,,,,,,,,,,,,,,,,,,,,,,,,,,,,,,,,,,,,,,,,,,,Boost Software License 1.0,BSL-1.0,"http://www.boost.org/LICENSE_1_0.txthttp://www.opensource.org/licenses/BSL-1.0",This license was released: 17 August 2003,YES,,BSL-1.0.txt,,,,,,,,,,,,,,,removed standard header. Not clear where this came from and does not follow rules for standard header field,,,,,,,,,,,,,,,,,,,,,,,,,,,,,,,,,,,,,,,,,,,,,,,,,,,,,,,,,,,,,,,,,,,,,,,,,,,,,,,,,,,,,,,,,,,,,,,,,,,,,,,,,,,,,,,,,,,,,,,,,,,,,,,,,,,,,,,,,,,,,,,,,,,,,,,,,,,,,,,,,,,,,,,,,,,,,,,,,,,,,,,,,,,,,,,,,,,,,,,,,,,,,,,,,,,,,,,,,,,,,,,,,,,,,,,,,,Borceux license,Borceux,https://fedoraproject.org/wiki/Licensing/Borceux,,,,Borceux.txt,,,,,,,,,,NEW-Fedora,,,,,,,,,,,,,,,,,,,,,,,,,,,,,,,,,,,,,,,,,,,,,,,,,,,,,,,,,,,,,,,,,,,,,,,,,,,,,,,,,,,,,,,,,,,,,,,,,,,,,,,,,,,,,,,,,,,,,,,,,,,,,,,,,,,,,,,,,,,,,,,,,,,,,,,,,,,,,,,,,,,,,,,,,,,,,,,,,,,,,,,,,,,,,,,,,,,,,,,,,,,,,,,,,,,,,,,,,,,,,,,,,,,,,,,,,,,,,,,"BSD 2-clause ""Simplified"" License",BSD-2-Clause,http://www.opensource.org/licenses/BSD-2-Clause,,YES,,BSD-2-Clause.txt,,,,YES,,"really removed ""FreeBSD"" from license name this time…",,,,,,,,,,,,,,,,,,,,,,,,,,,,,,,,,,,,,,,,,,,,,,,,,,,,,,,,,,,,,,,,,,,,,,,,,,,,,,,,,,,,,,,,,,,,,,,,,,,,,,,,,,,,,,,,,,,,,,,,,,,,,,,,,,,,,,,,,,,,,,,,,,,,,,,,,,,,,,,,,,,,,,,,,,,,,,,,,,,,,,,,,,,,,,,,,,,,,,,,,,,,,,,,,,,,,,,,,,,,,,,,,,,,,,,,,,,,,,,,,,,BSD 2-clause FreeBSD License,BSD-2-Clause-FreeBSD,http://www.freebsd.org/copyright/freebsd-license.html,,,,BSD-2-Clause-FreeBSD.txt,,,,,,,removed quotations marks around FreeBSD in full license name; Text file updated and filename for text file added (was missing),,,,,,,,,,,,,,,,,,,,,,,,,,,,,,,,,,,,,,,,,,,,,,,,,,,,,,,,,,,,,,,,,,,,,,,,,,,,,,,,,,,,,,,,,,,,,,,,,,,,,,,,,,,,,,,,,,,,,,,,,,,,,,,,,,,,,,,,,,,,,,,,,,,,,,,,,,,,,,,,,,,,,,,,,,,,,,,,,,,,,,,,,,,,,,,,,,,,,,,,,,,,,,,,,,,,,,,,,,,,,,,,,,,,,,,,,,,,,,,,,,BSD 2-clause NetBSD License,BSD-2-Clause-NetBSD,http://www.netbsd.org/about/redistribution.html#default,NetBSD adopted this 2-clause license in 2008 for code contributed to NetBSD Foundation.,,,BSD-2-Clause-NetBSD.txt,,,,YES,,,removed quotations marks around NetBSD in full license name; Text file updated and filename for text file added (was missing),,,,,,,,,,,,,,,,,,,,,,,,,,,,,,,,,,,,,,,,,,,,,,,,,,,,,,,,,,,,,,,,,,,,,,,,,,,,,,,,,,,,,,,,,,,,,,,,,,,,,,,,,,,,,,,,,,,,,,,,,,,,,,,,,,,,,,,,,,,,,,,,,,,,,,,,,,,,,,,,,,,,,,,,,,,,,,,,,,,,,,,,,,,,,,,,,,,,,,,,,,,,,,,,,,,,,,,,,,,,,,,,,,,,,,,,,,,,,,,,,,"BSD 3-clause ""New"" or ""Revised"" License",BSD-3-Clause,http://www.opensource.org/licenses/BSD-3-Clause,,YES,,BSD-3-Clause.txt,,,,YES,,,,,,,,,,,,,,,,,,,,,,,,,,,,,,,,,,,,,,,,,,,,,,,,,,,,,,,,,,,,,,,,,,,,,,,,,,,,,,,,,,,,,,,,,,,,,,,,,,,,,,,,,,,,,,,,,,,,,,,,,,,,,,,,,,,,,,,,,,,,,,,,,,,,,,,,,,,,,,,,,,,,,,,,,,,,,,,,,,,,,,,,,,,,,,,,,,,,,,,,,,,,,,,,,,,,,,,,,,,,,,,,,,,,,,,,,,,,,,,,,,,,,BSD 3-clause Clear License,BSD-3-Clause-Clear,http://labs.metacarta.com/license-explanation.html#license,This is same as BSD-3-Clause but with explicit statement as to no patent rights granted in last paragraph.,,,BSD-3-Clause-Clear.txt,,,,YES,,,NEW,"full name fixed (did say ""2-clause"" when should be ""3-clause"") and ""Clear"" shouldn't be in quotes",,,,,,added note,,,,,,,,,,,,,,,,,,,,,,,,,,,,,,,,,,,,,,,,,,,,,,,,,,,,,,,,,,,,,,,,,,,,,,,,,,,,,,,,,,,,,,,,,,,,,,,,,,,,,,,,,,,,,,,,,,,,,,,,,,,,,,,,,,,,,,,,,,,,,,,,,,,,,,,,,,,,,,,,,,,,,,,,,,,,,,,,,,,,,,,,,,,,,,,,,,,,,,,,,,,,,,,,,,,,,,,,,,,,,,,,,,,,,,,,,,,